event_id,terms
623909384417183,"thành buổi biệt thông tin đăng lượng gian h điểm quận phần ký vui thể diễn dành chúng hãy tổ chức dự kết hàng công thời viên nguyễn liên hệ thứ chủ nhật"
1514772282153569,"vietnam"
1118925088119512,"saigon vietnam chi"
1536427273264603,"hội chí minh triển mang nguyễn văn trường nội công chúng đầu gian thành viên sự động thời diễn"
311755245655422,""
1624545187788362,"chương trình vui thành hãy chúng đồng trường học hiện sinh hàng sự hội thông tin dụng tập thời gian dự công viên phí h trung đầu saigon tiếp lòng nhật mọi chi tiết liên hệ"
643591252450462,"chương trình học viên toàn thức chuyên tài kết hợp năng hệ kinh nghiệm trường đầu tư thực tế quan chi tiết thời gian thứ chủ nhật dành sinh mọi thông tin vui lòng liên hoặc văn nguyễn chí minh trung tâm tạo"
1094343180578474,"sinh nhật thứ tổ chức tham gia liên hệ trung thời Địa điểm nguyễn chí giá hình học buổi phần nam dành tâm phí thể giao tiếp h tài chi vui lòng biệt đầu"
1813491758875082,""
569504093201752,""
1640299296249931,""
993550154026187,"chương trình giải kết hợp sự kiện biệt saigon dành việt nam sinh tài thời bản hiện nhân chúng tổ chức tham dự h văn liên chủ giao gian"
137020169988345,"chương trình kinh nghiệm nam phần tham gia sự kiện mọi nhân chủ đề thể giá buổi saigon phí đăng ký cách hoặc kết giao công học quốc giải tổ chức việt"
1077965492215167,"chúng tiếp vui mang phần chương trình diễn dự thời gian đầu h chủ nhật phát Địa điểm tập trung gia tâm mọi chi tiết liên hệ thông tài văn hoặc sự quan"
929799053767763,""
1573780222895939,"động đồng thông chương trình giá dụng tài năng dành học sinh chuyên quốc gia tham hội kết nhân tổ chức"
1016313698389610,"saigon"
818042981641643,"điểm trình hội chúng giới việt nam trung quốc gian sự thể đầu tổ tham gia lượng thành viên nội chi tiết công khách tập kết thông h tiếp sinh trường quan tin đăng ký chương phí mọi đồng chủ tài vui lòng phát thời hợp toàn hình"
1502326910082235,"gia tổ chức chương trình thứ thời gian dự nhân tham vui lòng liên hệ lý đăng ký thành"
461298460744205,"tổ chức thành công tiếp thể cách thức tham gia hình đầu trường hợp tài thời gian thứ hàng dự biệt quốc giới lượng kết đăng ký thực quận chí minh Địa điểm hội thông tin giải giá"
1636273333309339,"pm"
361826890689198,"nhân hợp khách chương trình mang cơ hội biệt giá toàn dụng kiện thời gian chí hàng tiếp dành hoặc hệ tổ chức sự thể nội thành tham dự cách thức vui lòng tin chi nguyễn thông"
1521068511540029,"vietnam pm saigon chi minh"
883542348401279,"giới chi tiết học viên giải liên quan nghiệp phát triển tư đầu giá phí biệt thời gian tạo thể buổi hiện lượng nhân diễn tin dụng công tphcm năng chuyên"
439107936255724,"thông kinh quan lượng nhân viên hình công toàn thời gian chí minh cơ bản hợp đồng giao tin tiếp khách hàng năng thực hiện ký kết tư trình phát triển liên thế nghiệp trung lý động học thức nghiệm kiện thành tham gia giá sinh nhật phần nguyễn tphcm hệ vui lòng"
1017645984963730,"động sinh mang vui đồng thực chương trình sự lòng nhân hội hợp Địa việt nam phát dự kinh phí tài nguyễn mọi thông tin công nhật tổ chức"
939497092798943,"mọi chi tiết liên hệ hoặc mang nhân thể tham gia tâm giới minh dự phần phát thực giao công tạo hãy"
1491009331203182,"buổi giao tập trường tphcm sinh viên kết hợp công tổ chức học gian điểm hội h nội nhân việt nam thành văn phát triển phần nhật bản đăng hãy tham gia"
192597301083272,""
1661429304135978,"tổ chức thời gian sinh nhật buổi dành thể hình thành phần tiếp giá h Địa điểm quận tphcm lượng cách nguyễn liên hệ viên tài hàng chi tham gia"
743012149176424,"nội học động thời gian tiếp đầu thức thực ký mang bản lý buổi giới phí quận tphcm viên kết giá thông tin chi tiết vui lòng văn trung tâm việt nam giao cơ nhân công chuyên liên"
1181828128499301,"chương trình đồng dự gia thực hiện tạo phát triển năng hợp công sự kiện nội chi tiết thời toàn thể giải lòng tin nhân cách đề thế diễn chuyên nguyễn gian h thứ Địa điểm văn tphcm giá phí tham ký đăng lượng giới tổ chức hoặc"
1233002830058921,""
942354169169687,"saigon biệt công đầu mang toàn bản thời hợp liên sự động vui tạo thể dụng hiện mọi thứ tư gian thực trình diễn điểm"
758846707577663,"pm saigon vietnam nam"
1643527149195696,""
1233837203309392,"vietnam"
857622540975972,"triển quốc tế thứ tổ chức trung tâm hội nguyễn văn quận giá lượng giao liên công hợp việt nam hình kiện năng tiết trường gian sự thể hiện phát nghiệp thời động chương trình khách tham quan gia thế dụng thành học sinh chủ chí điểm tập nội hoặc diễn mọi đồng tài cách đầu tư"
916219201805250,"động saigon cơ hội thức liên quan trình phát triển dụng mọi tham gia giải công buổi diễn pm thứ quận"
1222058461147926,"học chương trình năng thông minh nguyễn nam sự sinh viên tiếp biệt toàn phí nội giải hình chúng thực thể giao cách động thế buổi tạo tư đầu diễn phát hội công hợp tiết thời gian thành dụng hàng vui cơ điểm đăng ký tham gia"
533649503465344,""
1642610872682544,"pm chi minh"
1522441931403370,"hàng giới thực khách diễn thứ cơ hội thức thế kết hợp đầu nghiệm nhân gian thành vui lòng"
466364126896947,"saigon"
738555442944145,"động năng kinh tế việt nam sự dự giao thông thành biệt hệ chí minh hàng công hội chủ đề tổ chức khách saigon tập trung chuyên gia phát triển đầu tư đồng tham toàn trường cơ mang thời gian Địa điểm quận phần kết chi phí giá đăng ký dành kiện giới lý tài tin tiết"
780757758717315,"vietnam"
944906258916704,""
1640423019530882,"học liên h buổi Địa điểm nghiệp thực hiện đồng chi phí kiện toàn nội lý nhân công động viên chuyên gia tư hợp trình văn bản giải quan dụng sự thế tế tiết năng thành"
471985069655963,""
641561649280745,""
957690017644113,"thành kinh khách chức sự viên kết toàn nội tâm gia liên tiếp công thời gian tin thể thế thức chuyên hàng thực học tổ biệt hiện chúng hợp hoặc lý nhân động hãy đăng ký chi tiết h Địa điểm quốc giá việt nam dụng tư hội triển cách đầu"
1672166549701268,"chúng chương trình hình thực tế lòng sự nhật nội hàng thể thế nhân giải thành chí minh tập nam tổ chức buổi giao cách quan điểm đề kiện hiện thông tin chi tiết thời gian h thứ Địa văn công dành đăng ký"
980751665296335,"tạo công thành nghiệp đề hình hợp quan hệ động dụng chuyên gia tiếp phát triển giới năng giao học quốc tphcm chủ hoặc thực hiện kết chương trình dự việt hàng thế nam vietnam tổ chức"
609445715860145,"nhân đề chúng đầu hiện cơ thể tâm thành chủ chuyên gia thế giới việt nam học nghiệm thứ năng lượng thông tin thời gian tư Địa điểm văn quận phí biệt đăng nguyễn tài"
181005068915906,""
1516210642033578,"pm saigon"
972722572770017,"saigon pm"
1059847834033875,"thời gian thông tin hiện tâm giao cách sinh học động liên quan sự kinh nghiệm thực biệt lý chúng giải cơ hội phát triển mang tiếp điểm thể thức nhân viên buổi h hình thế giới bản năng hoặc văn chí minh tập tham gia tổ chức khách hàng đăng ký kết nguyễn thứ Địa quận phí tiết dành vui lòng tài nội tạo công phần tư dự đầu việt nam hệ chương trình dụng chuyên trung giá chủ đề chi"
1714914705410262,"diễn tư kinh quốc cơ hội giao tế nhật tin hình phát triển tiếp thông nghiệp chủ việt nam lý chi tiết chương trình phí tham dự vui lòng liên hệ"
1709634665938326,"saigon cách trình thế chương đầu h"
886398668123104,"giải chí minh phí tiếp nhật"
344774822319519,"gia"
1674692909412629,""
758027511009337,"cách nhân thành trường việt nam"
505817212923414,"chương trình nguyễn nhân thời cách diễn gian h thứ Địa điểm hội trường bản lý tphcm tham dự"
520820201413981,"chi minh saigon vietnam pm"
893606694056340,"sinh viên tạo kiện học trường công tphcm sự kết thế hệ thành liên gian thời h Địa điểm tham tiếp đề đăng ký"
125122597852220,"chi minh h"
535978726569411,"mọi học phát triển chí trường sinh viên thành toàn thế giới công dụng diễn h chủ nhật tphcm Địa quận nội thể đăng ký hoặc tin tham gia"
503013489880764,"nhân thành tạo cơ hội tham gia học quan tâm chúng dành thể sinh viên phí năng bản dụng tài hình cách đầu tư công kinh nghiệm hệ thức quốc tế thông tin giá dự chi nghiệp lý chuyên điểm hiện tiết"
448681385319878,"saigon cơ hội chúng tiếp thức thể"
1519010425083454,"Địa điểm thành thời gian giá trường mang trung đầu phát triển toàn thế giới cách mọi hiện chúng buổi tập hợp tạo thể bản kết tổ chức saigon chuyên vui hội thức đồng phần dành nhân nội chương trình diễn tiết đăng ký nam sự hoặc chủ đề hãy hình"
920532884705447,"quan hình chúng lý thực hiện bản năng tạo kết mọi thế thể hãy vietnam vui sự đăng thông tin thời gian Địa điểm trung tâm công nguyễn tphcm phí tham dự"
1649574428587670,"vietnam saigon pm"
1717523641810371,"nhân việt nam saigon đồng trường thời gian thể tham dự tổ chức buổi diễn hiện lòng sự nghiệp thông tin h thứ Địa điểm hàng nhật nguyễn văn quận tiếp cách vui đăng ký thức"
963826993656703,"sự kiện diễn thế cách thức kết thành viên công thông động tham quan tổ chức chí minh giải đề thể phần gia đồng hàng quận nghiệm chương trình lý nhân phí chi vui lòng đăng ký mọi liên hệ hoặc"
1220030118104373,"cơ hội sinh sự thế giới nhân gia thứ tài gian hàng biệt dành giá nguyễn tâm thể tin hoặc phần"
863818937066030,"saigon pm"
846947242093547,""
497540377073623,""
541361516018697,"saigon pm"
136599536699616,"học trường tư hàng đầu giá phí chương trình nhân dành thành thông tin công hợp chủ nhật nguyễn tphcm lý kết tập năng hoặc động thể thực hiện vui lòng đăng tham dự hội liên thế giới việt nam tạo văn tổ nội quận"
1420029494955927,"thông tin hãy thành sinh nhật tham gia hội giá phần mọi chi tiết"
455637751283813,"tin bản biệt cách tham gia phát thông dụng năng hội học chủ đề ký gian pm thứ hàng điểm trung văn chương trình giao tiếp dành hoặc thể tâm thời trường vui giải đồng mọi lòng liên hệ"
899315940118243,"cơ công viên mang sinh chi liên"
622805614525410,"chi minh saigon vietnam pm"
165288087155118,""
1537877016467620,"saigon"
1528507317470530,"saigon h"
134204513609045,"ký tham dự hội sự chuyên gia hàng đầu thế giới tư tài cơ phần giá thông tin liên hệ"
1163434467004393,"pm"
543655185782549,"vietnam"
407571132769856,"thực nhật bản buổi sinh tài công thức điểm vui động cách tiếp diễn khách hàng giao chí quan hãy tham dự tạo hệ thành viên chủ"
185859111756213,""
1642038106013042,"thứ nội trường văn học công thông đăng ký phí vui lòng đầu dụng tập cơ bản liên hệ chủ tài nguyễn hàng quốc"
1495643027398937,"việt nam giao thành chí minh diễn phần sinh nội thức đầu công chương trình sự tham gia quốc tế tài năng hợp tiếp thực hiện tập nhân bản mang kết biệt thời gian h Địa điểm trường giá dành viên liên hệ"
918811078168615,"gia giá việt nam chúng học dụng minh nhật tphcm quan hệ gian tài sự nghiệp nhân tham dự phí chương trình hãy đăng ký hoặc tin hội trường"
1557137024539335,"thông tin thế tổ chức sự kiện mọi hợp nhật thể tham gia hình"
430795103770759,"đầu việt nam cơ hội thức nghiệm quốc gia thế giới dự công tổ chức sự kiện biệt nhân thành nội chí minh văn thực thời gian Địa điểm khách hệ hàng quan chi giá vietnam h"
545198285638570,"sự kiện mang nghiệm lượng quốc tế chúng công diễn gian tổ chức việt nam tạo tài năng thế giới điểm chương trình thời đồng thức buổi vietnam pm"
1525089304475624,"toàn"
1513489878975889,"vietnam"
985219994862772,""
1728490300705380,"tập trung sự thành công dự lý đề dụng quốc tế"
199405303727652,"đầu động lòng thành bản sự kết hợp thể dành năng diễn buổi thế giới hãy tham gia chương trình pm tin thời gian thứ kinh hình học nhật văn hiện tập trung toàn"
1628495450764448,""
1696580997242512,"kết thể đầu tổ chức thành mang sinh viên tài toàn tphcm sự tham gia trường học cơ hội hàng dự kinh tế tư hãy quan tâm nghiệm tin bản năng thức thế phần diễn gian h cách đăng ký phí"
986720544699750,""
1505314403101681,"quan nhân sự hệ tổ chức thế công lý giải chuyên tham gia tạo viên điểm tư phát triển hàng động tâm toàn tin thông thành vui thực năng chí thể dự chương trình nghiệp chúng gian học chủ nhật thời h lượng kết nam quận chi phí tài mọi tiết lòng liên"
697751497029151,"chủ đề"
1507873426195346,""
1022795431076237,"saigon"
958954417448605,"vietnam chi minh saigon hội việt nam tham dự sự kiện quốc tế triển thành thời gian Địa điểm chí trường nguyễn quận khách công thông tin nhật"
427718597425292,"chi minh chúng tổ chức vui phần trung tâm sinh động viên tham gia chương trình lòng cách chí"
909977732412511,"tập trung sự thành công dự lý đề dụng quốc tế"
1518755158444609,"chương trình tạo thời gian h thứ tư thức năng toàn lý hàng chuyên nghiệp hệ tổ chức công học thực kinh trường hiện giao phát triển nhân viên động giá dụng giới hình gia chủ việt nam tập đề tham tài hội phí văn tphcm tâm Địa quận"
1269087456450623,"thứ tổ chức buổi học phí mọi thực sự đồng phát đầu chúng thế biệt tham gia hãy thể"
1483723631934208,"thế giới buổi diễn mọi thời thể tâm chúng việt nam vietnam"
191603491180441,"chương trình tổ chức thứ hình thức hàng thành đồng dự thời gian tiếp sự viên học tạo lòng thể công kinh phí thông giao chủ đề nhân giới hiện văn trung tâm thực hợp mang nguyễn phần thế hệ khách điểm h Địa quận giá toàn tài chí minh biệt đầu việt nam hội tế quốc nghiệp trường quan sinh năng tư tập động mọi chi tiết vui liên tphcm"
1048580948520263,"Địa điểm quận thời gian pm tham gia đầu giá vui buổi sự hàng thức thể hiện chuyên dụng thành hình giải saigon phần hãy dự"
196339154035041,""
517006541812237,"saigon vietnam pm"
1617910321803458,""
1647685948816343,"năng cách bản hãy việt tham gia h thời gian"
625905840883347,"thành thứ đầu điểm toàn tạo động chủ nhân dụng thể hiện năng tâm buổi diễn mang thế giá chương trình pm phí tin công lý phát triển tập trung tế dành bản"
142608832761191,""
411775655692658,"chi minh vietnam"
446205618897286,"hội học toàn tổ chức thực hiện quốc gia trường hàng đầu giá thông tin đăng ký sự kiện dành nghiệp khách hoặc sinh viên kinh"
1520378681616309,"vietnam chi minh saigon"
1517636418547610,"thành viên chúng vui thông đầu đăng ký tham gia tổ chức chủ nhật quận thứ tphcm đồng thể hội nghiệp hàng sự thế biệt công trường học nhân hoặc hãy lòng tâm hình thức giá cách kiện phát tin mang dự điểm văn khách quốc tế hệ nguyễn chi tiết saigon"
557425051079579,"saigon chi minh"
189465291389771,"nhân chương việt nam công nhật tổ chức văn chủ đề cơ hội học viên toàn thể hiện tài năng giao thời gian tập hãy tham dự tiết khách"
420322011496986,"chi minh saigon pm"
1676855795934448,""
537888643030709,"giao học tạo kết thành công trung sinh chí minh tổ chức"
1524383694550949,"quốc gia hàng đầu tạo phát triển khách điểm sinh viên việt nam thể học hợp trường tổ chức buổi đề chương trình cơ hội nghiệp quan tâm hiện chuyên thời gian Địa quận tphcm mang thông tin giá phần sự ký tham mọi chi tiết liên hệ nguyễn vietnam"
1654600748150652,"sự tin bản điểm học năng giao tiếp buổi phát đăng ký kiện đầu viên thành mọi liên hệ"
742380505895733,"buổi hội trung tâm thể hình tổ chức sự hợp hàng thức thực cách tập đầu hiện thời điểm tư thế biệt chuyên viên kinh đồng nghiệm tham gia năng động giới phần lượng phí hãy thông tin liên hệ gian"
1162044413810114,"saigon"
1631310107158147,"saigon sự kiện tổ chức thứ dành động quốc tế việt nam trình diễn giới cách năng tham dự mang chủ đề hàng"
111872519182102,"saigon nguyễn thành"
199849900347668,"nguyễn vietnam"
1723582064530645,"hình sinh nhật cơ nam buổi hội vui thể biệt mang tham gia nội đầu hãy"
1560166957556972,"học mang cách thể cơ bản lượng đồng thời công hàng đầu sinh viên thực hiện đề tài nghiệp tham gia giá buổi h hợp quan hình nhân giới dự gian thông dụng chi tiết"
631984013611089,"chi minh"
423850587821938,"sinh gia hàng sự thành công bản dự tham thực tế cách mang tiếp thế giới nội tâm hợp thức mọi thứ giá cơ hội buổi biệt chúng kết nghiệm giao năng hình trình tạo quan hệ hãy học tập phát triển liên thời gian động thông tin Địa quận phí lượng"
1478733555721515,""
157307111289538,"hội quốc chủ đề nam vietnam chương trình giao kết văn thể thực đồng việt nội tế thời gian thứ nhật Địa điểm tphcm tổ chức tham gia phí"
1015853445139298,"chi minh saigon vietnam pm"
592124860905156,"tphcm giá chí minh quốc hình thế gia toàn sinh văn khách hoặc chủ thể cách đầu hội sự kiện chuyên thông tin mọi chi tiết vui lòng liên hệ"
945572608838012,"chi minh vietnam gia saigon pm"
1642191769376008,"vietnam chi minh"
795736280537475,""
570911803060678,"liên tiếp saigon tin thứ thức thể"
985906324765664,""
1930019240555872,"tham gia"
749973298425444,""
492765987567572,""
433643840174870,""
1691219434441644,"nam lòng thực tạo động công thế sự kiện phát hàng phần chương trình tiếp thức thành tâm việt chúng nhân giá mang tập sinh viên cơ học liên hệ hoặc quận thời gian h Địa điểm chí minh"
1667371076875337,"thời gian Địa điểm học tham gia sinh viên trường trung ký h nam phần đồng thức thực động thể hội công liên hợp quốc thứ diễn sự kiện mang toàn tế giới tài phát triển nghiệm cách đăng dự giải cơ thế quan đầu đề kết khách quận thành chí minh nhân hiện việt tổ chức thông giao tiếp chúng tin hệ tâm tập"
489692841197214,"tphcm văn chương diễn triển gia nguyễn giới quốc đầu hội ký dự biệt"
1626927544222999,"dành chương trình giao kết"
913202995427226,"tạo thành công nhân sự thể nhật tphcm cơ hội giới kết mọi liên"
431581403704434,"minh"
735077243302720,""
1659631944249503,"vietnam gia kết nguyễn chi minh"
914116092001142,"sinh viên phát triển bản tin dụng nghiệp thông hội chúng mang kinh nghiệm thế hệ học chuyên gia động giải đề tiếp cơ thực tế tham quan giao tphcm quốc dự dành toàn công việt nam thành thời gian h Địa điểm trường quận tổ chức sự nguyễn tạo đầu tư chủ"
478185015694131,"pm vietnam saigon"
1641444309454295,""
165164663837984,"tập quận giá liên hệ tư"
796359963823801,"saigon pm"
745423882251661,"saigon"
994105733994799,"trung tâm phát triển đồng tổ chức tham dự buổi chủ đề động tphcm công thực hiện kết thời gian h thứ tư Địa điểm nguyễn ký trình chi hội"
141783372845728,"pm"
1654326954816284,"quan kinh"
1492874717709061,"biệt thành viên kết hợp nội chương trình tập trường chúng thời gian điểm h chủ nhật phát tư hàng bản chi phí"
877417562306505,"nam minh thời gian Địa điểm trung tâm triển hội văn quận tổ chức công việt nghiệp hàng liên hệ cơ động toàn phát giải tiết đồng gia thực thức tư dụng"
979805182080949,"thành buổi đăng ký tham dự kiện cách chí minh đầu h chủ nhật tiếp học dụng viên điểm quận"
185119101830875,"động trường nghiệp hàng giới hợp đề giao tin cách thức kiện chúng saigon tổ chức buổi chủ kinh nghiệm phần tham gia hoặc quan tâm nguyễn quận tphcm thứ phí tài thông công nhật chi thể vui lòng nội"
928651557224644,"h thứ hội trường tiết chi tổ chức tiếp kết tạo sinh viên thể hiện tài năng bản kiện phát triển diễn học công nghiệp tphcm hãy chúng"
322719451185700,"hội cơ chúng việt nam gia biệt chủ đề năng nghiệp thức hợp nhân lý"
904360302946503,"hội nghiệp chuyên hàng khách vietnam triển chương trình phát hệ nhân việt nam sự tổ chức đầu hợp trường học chí minh dự tham sinh viên thành thời gian Địa điểm nguyễn tphcm nội cơ gia tập công hiện tiếp dụng đề lý giá tài năng vui lòng liên thông tin chi tiết động cách thức đăng ký dành chúng nhật"
500423840117190,""
114129678945593,"pm saigon"
715990218523326,"cơ hội vui lòng thực hiện tham gia chương trình sự kiện đăng ký thông tin lượng dụng liên hệ mọi"
1388442324796856,"tiếp thành công học tổ chức phí viên đăng tphcm gian chủ nhật hội trường nguyễn văn quận chúng tham dự gia vui lòng lượng điểm thức tài thông tin"
1640326062879659,"sự kiện đầu tổ chức tphcm hiện động diễn chuyên nghiệp việt nam biệt nhật bản thể gian hàng hội triển liên thông tin hãy"
1075252359181865,"vietnam chi minh"
687073791393597,"saigon"
505404526303554,"trình dành nhật thức h thứ tư tphcm học viên gia nam kinh trung khách saigon vui lòng thông tin chi tiết chương gian chúng đăng ký cơ hội buổi bản thời thực toàn thể thành dụng nghiệm tạo chủ hình nghiệp mọi hàng hoặc kiện tham đầu đề nội mang phí lượng biệt quận nhân tài việt liên phần diễn lý công động chuyên sự tiếp hiện giao Địa điểm cách"
1633215753600006,""
1913467532211684,"tế cách học thể chúng hãy"
1653481344921139,"trung tâm giao văn nhật bản việt nam giới chương trình liên diễn chí minh nội sự kiện lượng hàng phát thời gian lòng mang chủ đề gia ký toàn phí điểm đầu thành thứ Địa tphcm mọi thông tin hệ quốc vietnam chi"
931046223653785,"thể học nghiệm chương trình thời gian h thứ Địa điểm tphcm tiết sự kết hợp đăng ký hoặc tin tham gia nội"
147114455645070,"đồng tạo chương trình thể hoặc sinh viên tiếp học nhân điểm trường hãy tiết hợp việt nam hội tphcm văn chi quận"
184444461897531,"h"
1195426057139585,""
944752558928290,"quan tâm gia bản giải đề thực sự động đồng việt nam giá chúng học dụng hãy dành kiện tổ chức chủ nhật quận tphcm khách nội tham dự phí đăng ký hoặc tin chương trình"
1651946085088278,"gia buổi hàng saigon thứ thức việt giới"
690716074397661,"pm"
921743211214812,"saigon"
923272477722495,"h saigon"
635731223198422,""
530966487077466,"tiếp thành công đầu vietnam chúng thực hiện thứ chủ đề diễn giá tham dự ký thức chương trình tổ chức sinh viên việt nam động toàn chi phí nội mang hãy thông tin mọi thế"
1650760668536515,"vietnam chi minh trung"
