event_id,terms
832878440162138,""
705312679603964,"saigon chi minh vietnam pm"
741573269308723,"saigon"
1648052285418189,"vui thành công đề nhật trung tâm quốc tế biệt điểm cách trường thời gian pm thứ hàng Địa phí tham gia việt nam thông tin chi tiết"
184165651924959,"đầu chúng hãy thức tâm tham dự vui chủ thời gian thứ nhật Địa tổ chức sinh viên học minh"
506342142874538,"khách hàng giá lượng"
850447408407557,"cơ hội học toàn phần trường kinh ký tiếp thời gian thứ Địa điểm văn công tư nguyễn tphcm chuyên thế giới nhân tạo quốc tế sinh viên nghiệp chí chương trình bản giải kiện đăng trung đồng thông cách thức vui lòng hoặc hàng đầu tập thành thể thực phí động"
923560931071519,""
446234268895916,"hội học giá thành tạo công trung tâm trường động sinh viên quốc tế đầu hoặc giải kinh lượng năng toàn lòng nghiệm thứ nghiệp chuyên dự cơ tham gia thời gian Địa điểm văn nhân quận trình ký thông tin chi tiết đăng minh tài hợp tư tập"
1532926813694297,"nhân quốc tế buổi đầu điểm tài năng kết hợp tạo sinh kinh nghiệm sự lượng quan hệ thể mang vui lòng chương trình pm phí tin hiện đồng thời phát triển thành chủ thế giới nhật bản dự diễn tiếp công thứ động khách hàng tổ chức liên h tham gia tư thức hội tâm dành chuyên"
1212368625446112,"phát triển thông tin trường sinh viên hiện thực chủ nhân thành biệt thức tiếp đăng chi tiết hãy ký"
564214203736354,"saigon thể nghiệm toàn sự thế tham gia"
1043281959036382,""
1405085129821337,"đầu tư thông tin chi tiết hãy liên chúng hợp"
192596887742760,""
1676329352608101,"quan tâm giải toàn đề hãy đăng ký thể hàng đầu tài giá tư kinh nghiệm giới thời gian chi tiết liên hệ văn minh"
134970850201139,"buổi chi kinh nghiệm sinh dành chuyên gia chúng phát triển trường"
721108484687936,"tham dự sự kiện buổi chúng trình biệt tiếp cách thể nghiệm diễn mang quốc tế sinh học trường viên tạo tài năng đầu kinh tổ chức chương thứ phí mọi"
492112924325606,"chi vietnam saigon minh nam"
1060349784009934,"pm"
1334681039881631,"ký tham gia chương trình giao khách liên nguyễn thời gian Địa điểm học hợp tphcm lý giới chủ đề động đầu tập đồng thông tin cơ bản thực công thức quan hệ thể hàng toàn giải hiện kết nhật hình dụng"
714237438711761,""
467760970075640,"quan tâm gia bản giải đề thực sự động đồng việt nam giá chúng học dụng hãy dành kiện tổ chức chủ nhật quận tphcm khách nội tham dự phí đăng ký hoặc tin chương trình"
1669437033340250,"phí học mọi hình thức tập dành quan biệt giới nhân công nhật giải tâm hãy nghiệm sự nội tphcm chương trình nghiệp chuyên gia liên tổ chức khách hệ chủ lý tài gian đăng ký tham dự hoặc tin đề diễn viên kinh quốc tế đồng tư phát triển thành dụng trung sinh"
1653917291543568,"thức động hệ toàn quốc nội chí minh tiếp phát triển sự thành công tin tâm mang khách nghiệm lượng giá hàng chương trình"
527385800759438,"chương trình tiếp nam nhật bản thứ thành chí minh diễn sự tham gia"
172015596484680,"trường tài công"
608762552594198,"động biệt tổ chức thứ hàng năng giao tiếp tin học trình ký tham gia thông thời gian pm Địa điểm nguyễn văn quận phí chủ nhật việt nam"
1675390636081561,"học thời gian tập cách nhật phí ký"
1035314519836199,"công phí việt nam thức dự thứ diễn tphcm quan tâm trung chí nhân hoặc đầu liên tổ chức nội quốc gia toàn quận nguyễn phát điểm trình cơ hội giao buổi kết thời tham hình giải"
503683439801590,""
566175580204077,""
427989960731914,"gian thời h tphcm phát phí Địa điểm tổ chức kinh dự cơ nhân chi trường nội thành tâm kiện sự tin chương trình công mọi tiết vui lòng liên hệ tài nguyễn hàng"
502407396600024,"việt sự kiện hàng hãy đầu giải văn tham gia thông tin chi tiết"
1159030577448377,"gian hàng quốc gia trung nhật bản việt nam"
423159877876048,"tphcm nhân thành trường liên viên thời dự buổi hàng h thứ điểm quận chương trình khách lý sự đồng chí"
1109265265750628,"vietnam"
436888249849609,"saigon vietnam pm"
1659661840956158,""
1649728361965138,"chương trình thực hiện học trung"
886099961445115,""
554380491387541,"phần thức nhân tâm lòng việt nam sự chúng giá mang gian dành quận chí minh thời h chủ nhật lượng sinh thứ liên hệ hội tham gia công tập trung phát kết chương trình thể thông tiếp động ký hình tài chi thành nội"
929996930426373,"sinh viên chuyên thành thực lý nghiệp hình công tế cơ hội tập đầu tư học chương trình quốc trung tâm thế giải quan sự phát triển khách hàng giao tiếp kinh nghiệm đăng ký"
1703776966504174,"nghiệp đề phí cách kinh lý khách hàng sự kết hợp thành phần phát triển thể công tài nội chi tiết thông thế thức tế thứ thời gian pm Địa điểm nguyễn lượng tham dự chủ hoặc quan chương trình giải giao tin chuyên gia viên quốc tạo nhân học hình năng bản tư toàn minh nghiệm tổ chức h đăng ký buổi"
1621257701440717,"thông tin việt saigon thứ hàng chuyên nghiệp thể tập hoặc cơ hội nghiệm buổi bản dụng nhật tạo kiện học lượng gian hãy thời phí dành thức"
1656401337951247,"hội thực chuyên kinh thức diễn thứ Địa điểm quận"
148966468795177,"saigon"
489124871259892,"công trình thời gian bản thể hiện tài lượng lý trường liên thức động nhật chuyên gia học thông tin chi tiết"
509073795927959,""
112055882496156,"sự kết hợp tạo động chương trình diễn năng bản thế giới tâm hoặc thể hiện dành đầu pm phí tin cách trường nghiệp học quốc gia tập trung chủ đề thực hội điểm giải tham dự phát"
147836405575804,"dụng tạo thế mang tế hình cách hàng việt nam phần trình học giới thành chí minh mọi sinh chuyên công phát triển thời hội sự kiện hãy chủ đề tài năng thể kết động đồng"
413613492176268,"liên thứ tphcm saigon thể quốc tế việt nam chí tổ chức động chuyên khách văn học giải giá sự năng diễn thế giới thành minh hiện đề nhật bản nguyễn nghiệp trường h tư vietnam chủ trình"
428507854007363,"tham dự học kết hợp trường quốc tế diễn h thứ hàng đăng ký"
1508347219459135,"chi minh saigon vietnam pm"
1660504720886715,"vietnam pm"
1694036784158640,""
1633865473528494,"hội dành trung tâm"
1638603683071537,"saigon"
919883004725577,"buổi công chí khách biệt"
1484603061846426,"cơ bản dụng phần chuyên tạo diễn kết công cách trình hình thành thực giá minh việt nam hiện mọi tư trường học sinh viên biệt nội chí thể tế năng hợp động nghiệp nhân hệ quan tiếp lượng thông thời gian lý buổi phí liên thức dự thứ thế nghiệm hoặc triển kinh chương tập tài hội giải đăng toàn"
476987945841463,"hiện thế giới tiếp dụng đầu đề quan tâm giá mang công tập chủ nhân hàng liên kinh tạo thức khách thành trình cách thông tin học tài thực chuyên năng trường thể hãy chúng toàn thời gian thứ hoặc Địa quận chí minh trung phát triển tổ chức viên tế biệt sự tham gia nghiệm việt nam phí đồng buổi hội hệ"
975449605847497,"sự kiện đồng tphcm tài năng nguyễn thành diễn vietnam công tổ chức chúng mang lượng đầu tư hệ thể giá phần sinh viên"
1656788981261051,"trường động sinh viên học thức năng nghiệm văn tạo sự nghiệp thông tin chí điểm cơ hội trình toàn phần giá đề trung tâm tư quốc tế giới buổi thời gian chủ nhật Địa quận minh kinh tham gia giải hiện chi tiết thành công thế đồng nội nguyễn việt lý chuyên chương mang tập dự hãy ký"
1523381281314094,"khách tổ chức sự kiện năng thức chuyên nghiệp đầu tham gia chúng buổi đề thành công trường tạo thế giới thời gian h chủ nhật Địa điểm tphcm đăng ký dự thông tin"
1519188885061886,"chương trình nhân đồng phần tiếp động tin cơ hội phát triển tâm quan cách sự"
499466390227177,"chương trình đầu tư công tổ chức mang sinh viên biệt buổi hàng động thể tiết văn tạo thời hãy tham gia nghiệm"
104739873227552,"vietnam"
736854409753137,"saigon"
1686890481593187,"nhân thành tạo cơ hội tham gia học quan tâm chúng dành thể phí năng hình tài thực tế bản dụng cách đầu tư công viên lý giá tin dự chi nghiệp phần kinh tiết hiện phát triển chuyên điểm nguyễn tphcm"
1185739131454038,"giao sự hoặc thế giới kiện tổ chức"
419239658279508,"sinh minh thời gian Địa điểm công viên tập trung chúng tham gia dụng tâm mọi hoặc nhật buổi động thông"
1490608407901635,""
1637955923126632,""
1097491116941832,"cách nghiệp nhật bản thức tiếp khách hàng lòng sự quan tâm động vui chúng thể dụng lượng công kết trung hợp nhân việt chuyên gia lý kinh nghiệm thông tin chi tiết"
147122932314782,"thứ tư Địa văn phí tham gia ký dành hãy hiện thể động quan tâm năng lượng bản kết học phát triển tập trung hệ công tin buổi nghiệm kinh lý nghiệp"
1683213978558267,"chủ động giải nhật bản"
874334249323234,"thời gian Địa điểm vui giải tphcm khách nhật toàn tham gia hội học hàng đầu ký thông tin đăng"
699502706817410,"hàng thời thực hội diễn"
762028467236161,"tiếp phát triển hệ sự thành công chí minh tin tâm mang khách nghiệm lượng giá hàng chương trình thứ điểm thời gian chi phí hãy động viên chúng vui toàn quốc biệt sinh đầu việt nam"
1024404200913038,"saigon buổi diễn kết hợp pm giải giới trình hình hiện thứ chúng nghiệm quốc tế công sự thể mang bản tạo cách viên biệt học thế lượng đầu động chí việt nam gian lòng thực tiết"
981889315202456,"nghiệp động giải phần công triển sự thành khách hàng tạo chuyên năng dự quan thức chủ dụng kinh chúng đầu tư tâm lý tài thông tin hệ cách sinh gia"
520514754791299,""
414057348785375,"vietnam"
623228254478204,""
758722094239535,"tạo thời gian nhân tài viên hội nghiệp thành giải đề mang thế động đầu tư chi phí dụng sự hãy học cách phát triển năng hàng chủ quốc gia toàn công hệ thông ký h Địa điểm văn quận tphcm mọi vui lòng liên"
489393957905197,"vietnam"
186283245051572,"chi minh saigon vietnam pm"
1717752625120818,"hội tổ chức chi tiết"
980109532046690,"pm"
1006657816062381,""
770446929732029,""
190853124587106,"sinh thứ động mọi gia thể học giải giới hệ cách tâm tài sự tiếp thành liên nội chí đề bản thức phần chi nghiệm thời gian thực tổ chức công biệt toàn hiện chúng hợp hoặc lý nhân hãy đăng ký tiết h Địa điểm quốc giá mang kết"
1653871418226721,""
934528249967335,"đầu việt nam mang dành công nghiệp sự kiện kết hợp hội hình hoặc nghiệm thể đồng giải toàn thời gian pm giá tham gia năng tạo quan hệ mọi học kinh thành thức bản cách cơ hãy đăng ký phí viên dự thông tin chi tiết liên vietnam"
543887232441917,"gia nam thời gian Địa điểm trung tâm triển hội văn quận công việt nghiệp hàng liên hệ động chức năng đồng tư hợp cơ lý tạo hình"
1671070769775735,""
825881260800727,"sự kiện diễn thứ kết hợp giới việt nam trình tài saigon biệt thể hình hoặc tham dự phát quốc pm lý"
913726102016230,""
542668749205988,"chí đồng thời kết chương trình mọi cơ hội thể hiện bản mang tạo vui sự hoặc chúng chi tiết"
632343673535086,"pm"
143844432640742,"saigon"
905008766246226,"việt nam diễn đầu sự kiện tham dự biệt cách mang hội dành vui gia động viên chuyên nghiệp tạo cơ tập quan hãy nghiệm tổ chức đăng ký Địa điểm tphcm thời gian thứ vietnam pm"
115510352145960,""
540286862788351,"giao phát viên chủ đề liên hệ chương trình thời gian h Địa điểm quận thành giá hoặc thông tin mọi vui lòng"
795999260515174,"động biệt tổ chức thứ hàng tin học bản hoặc thể trung tâm thời gian trường vui cơ hội mọi pm Địa điểm nguyễn tphcm ký tham gia phí giá chương trình phát thông dụng năng chủ đề giải"
525586757605679,""
858874757559077,"học viên tham dự hội diễn chí minh nội khách quốc tế trường hàng tạo công tiếp ký"
192475747754735,"thực hiện nghiệp đăng ký bản phí thời gian công thể giải phát lý thế biệt nam thông đề phần chương quan việt gia tổ chức toàn hình sự trường mang kiện thức liên sinh kinh tế hãy diễn văn hội viên quốc nghiệm tư"
991910604185166,""
1666564306896462,"nam chi minh"
1663023173954359,""
1667176276899761,"học sinh việt nam tham dự buổi tiếp hội công tổ chức thời gian thứ Địa điểm văn nguyễn minh chương trình trung trường thế giới hiện sự hàng đầu viên quốc tế tạo nhân biệt năng thức kết tập quan tâm ký tin"
1254733711210840,"sự mang thực saigon h thời gian"
511667155662904,"vietnam saigon chi minh"
453667674816044,"vietnam"
878190755634253,""
1521727101485445,"saigon gia pm"
1736114333285649,"mọi nam sự đồng điểm tổ chức động tham gia biệt chúng tập trung thời gian thể diễn tiếp hoặc thông tin vui lòng liên"
811739372281195,"nam hàng tâm hợp tổ chức buổi nhân quận sự tạo phát thành chương trình phần kinh phí dự thức quan thời gia học triển chi tphcm"
1661242774134560,""
194438797565243,""
1671816919707903,"minh thời gian giá phần phát tâm kết tham gia liên hệ cơ quận sự kinh hoặc mang vui"
1052151534809365,"hàng mọi tâm thứ hãy chủ đề sự tin buổi phần toàn mang sinh đồng trình thời gian pm Địa điểm saigon công quận thành chí minh giá lượng đăng"
1528758890748931,"động thế giới công tiếp học cách chúng hãy dành vui chủ đề điểm thông nội tư thể năng dụng gia thành thời gian nhật Địa saigon nguyễn văn quận đăng lượng giá phí tham sự kiện phần"
471379523018564,"vietnam pm"
1115755325103483,""
1635747950032736,"thành công tổ chức tiếp chủ nhật điểm tế bản thế giao giá lượng gian hàng tập trung kiện nội chương trình giới viên tham gia dự hoặc vui lòng đăng ký liên hệ mọi thể"
497474997090416,"sinh viên trường tạo liên công phí thời gian kinh nghiệm nhân cơ hội nghiệp thực tế tiếp thông quan hàng tư hợp giới chuyên tổ chức thứ toàn sự biệt năng dụng đầu gia học kết mang hiện tài phát triển khách đồng tin kiện diễn Địa điểm nguyễn văn quận ký"
755473814599301,"saigon vietnam pm"
441839982667436,"thành công chương trình học viên thể sự thế kinh dụng tạo triển lý nhân hàng cách trường hệ kết hợp đề tham nghiệp trung thức năng chuyên thứ thời gian động dự tổ chức cơ phát hình giá chí tin h lượng buổi nam quận mọi vui lòng liên"
1695189700704438,"vietnam"
917775454980540,""
856704631068589,"thành lý công nghiệp tphcm thông kết phát triển chúng quan hệ tạo giá sự kiện hội giao thế sinh viên học nghiệm thứ"
1701251846786746,"nhật bản tạo hình thông thể thành thế giới dụng hãy phát triển tư học gian tập trung quan chi tiết phí tham gia sự kiện phần dành đăng buổi lượng diễn chủ nguyễn văn quận"
913224282097618,"giới mọi bản thành công đồng thời phần việt nam thứ trung mang gian h Địa điểm nguyễn tphcm lượng dự hoặc đăng ký cách thông tin tư"
1678424979065826,"thứ h chủ nhật Địa điểm văn phí học"
436004849930354,"thành viên sự kiện phát triển sinh nhật thứ thức diễn h trường cơ chúng dự"
1903560073203000,"saigon"
922981211110550,"lòng hội công đầu thông tin thức"
516654305161658,"vietnam saigon"
923304757761862,""
573130449507448,""
915555705185172,"việt khách saigon tham dự biệt thế thực đầu hàng lượng vui lòng"
1634227493510358,"thành phần tham dự nghiệp chuyên viên công thức năng chương trình tạo biệt trường hàng đầu quan nhân tổ chức thời gian động thông đồng kinh minh khách lượng học buổi h thực tập phí giá ký lý gia phát triển sự giao hội Địa điểm quận văn tphcm hoặc tư chi đề dành vui lòng tin chúng"
1674987226048875,"pm h"
1638960129727035,"vietnam chi minh pm"
1641671362774614,"việt nam thứ thế giới sinh học hệ động thực thời cơ quan chức năng hàng hợp tổ giao phát triển tiếp mang lý hiện lòng diễn hình công thể hãy đăng ký tham gia hội sự chương trình chúng mọi chuyên gian dự điểm chí minh thành viên trung thông tin liên nguyễn"
931770880212003,""
171967523146277,"vietnam"
1232287183454381,"phát gia"
1668763606671752,"đồng việt nam hợp tổ chức tham gia phí sự kiện thời gian công chúng thành viên khách dự phần trình dụng"
156832861335620,"việt saigon pm minh bản động chúng gian giải biệt thứ thức Địa điểm thời giá phần tiếp phí"
1136662996361958,"vietnam chi minh"
917721075007526,""
963606073713590,"chương trình chủ đề giao vui hợp tâm thực hiện thời gian nhật Địa điểm trung văn thể tphcm công thông tin thành hàng tiếp diễn buổi"
491058557709091,"chi minh saigon vietnam pm"
1245920382101712,"chương trình"
921413567927314,"đề quan tâm hàng đầu thế giới tổ chức tế phần tạo kiện đồng cơ hội phát hiện dự lý công thông hợp chương trình trường tư phí liên động sinh chủ dành khách tham chuyên gia viên toàn tài buổi kết tiếp vui lòng đăng tin thành ký nhân thứ thời gian h mọi hệ"
170397459977822,"nhân công tâm sự gian h Địa"
317331685104220,""
1699526300334531,"saigon pm"
117378128624899,"sự kiện tập hợp thông tin buổi phí tham dự nhật liên hệ giải mọi"
1494651544163641,"học tập công nam hãy đăng ký tham dự hội cách kết đề động thành nhân nghiệp sinh viên cơ liên"
906526716092147,"giải việt chí minh sự kiện thể thành tổ chức chuyên nghiệp năng động đồng tiếp công liên kinh tham dự trình hãy quan diễn tin thông nhật tập buổi chủ đề đầu thời gian h Địa điểm viên gia trung tâm thứ dành giao hoặc vui"
684094101690679,""
1679693232317526,"chủ đề quan tâm biệt động hiện kết thành toàn thể hội điểm cách phát thực tế giải thức thế hệ triển chương trình tạo chức năng lý thời pm học Địa quận"
906260389439210,""
496036427268213,"kinh nghiệm chuyên gia bản tin thế giới tạo hình nhân thời gian h diễn văn sự hiện thực nguyễn trường dự nghiệp viên"
204623723202537,""
1097525770265879,"nghiệp tạo đầu trường học nguyễn thành động toàn tphcm thức tư kinh nghiệm năng thực viên giá thể công hãy đăng ký tham gia nhân sự cơ hội buổi quan tiếp kiện tập triển giới sinh chuyên giao"
1607843346160408,"tổ chức hội trường hàng chi tiết"
1634811676806312,"dành học sinh trung chủ đề hàng liên mang nhân văn giải hiện thực đầu quốc tế thành hội toàn thông thức quan hãy nhật tin"
910435195709879,"chúng tham gia sự kiện thứ nội chương trình tập biệt kết hợp phần động học viên thực hiện hãy đăng chi tiết thời gian tiếp Địa điểm việt nam phí thành thế giới lượng dụng phát triển trung tâm vietnam"
184997641682726,"sinh chương trình hội học hàng viên phát động điểm cơ thể hiện năng biệt"
1651077358490304,"vietnam"
1049885751717830,"saigon pm"
778725858916053,""
1481083745533238,"sự kiện biệt điểm lý dành chương trình giá hàng hệ"
1703998466479897,""
1526832960967465,"việt thứ tham gia chúng thể hiện hoặc thức phí"
1621002981483264,"tham gia thành viên nhân đồng tạo thực hiện kết nghiệp tập hợp hàng việt nam thức nghiệm chuyên động triển sự kiện tư tiếp chương trình thông tin quan trường học thế giới giá giao thời hội toàn gian trung thể mọi bản phát kinh tế công hình cách văn năng phần chủ lý cơ tổ chức phí dự nội chi tiết liên hệ đầu vui lòng"
493719907454733,"sự kiện hàng khách tham gia quan đề sinh toàn thực dụng thức lòng cách chuyên nghiệp nhân viên chi phí đầu thế lượng giải công lý mang chương trình hợp chí tư hiện giao kết kinh dự cơ hội chủ dành giới tài việt thông tin hình thời gian đăng ký tiết hoặc liên hệ"
1024496687595216,"chương trình triển việt nam kinh thông minh công trung tạo chuyên nghiệp năng tiếp dụng kết vietnam hãy liên hệ chúng hàng nhật bản viên toàn chí"
703531249746900,""
1691900327712119,"phát triển thể thành hội động buổi vui văn sinh nhật chúng chương trình diễn tham gia mọi"
739791859460625,""
939849736108849,"việt thể gia quốc thời lượng diễn viên sự nghiệp tham mang chủ đề"
451197695066678,""
631265380347638,"thời gian điểm giá"
1633057173615681,"pm bản thứ hội thành h chúng động cơ mang tập dụng"
521058938061840,"sự kiện tổ chức đầu saigon cơ hội giao hình nhân sinh nhật thứ giá phần dành"
1649497315327916,"công Địa tổ chức sự kiện giới hàng dự triển hợp phát khách cơ hội động chương trình buổi diễn giá dành tham thức biệt hãy đăng ký"
1482282252076913,"thời gian Địa điểm trung quận chương trình hàng nghiệp năng tiếp trường thực gia dụng nội công văn tham nhân mọi thành phần kinh tế thông tin liên hệ sự tphcm"
738541012946372,"tổ chức saigon nam quận hội đầu hiện tphcm lượng gian hàng đăng thức diễn hình h thể sự kiện thời Địa điểm"
714537595342870,"hàng thời gian chúng khách biệt chuyên quốc tập trung động năng tế sự đầu kết chương trình thể tổ chức mang hợp dành pm saigon"
1632599073621622,"thông tin việt điểm sự hiện chúng diễn phí dành trình hợp"
1715978725289059,""
1659170661026981,"trường công kinh tế học quốc gia"
175717846112495,"trường tạo khách quốc tế"
1219579281404698,"quan hệ hợp việt nam công đồng thời tạo cơ hội giao kinh nghiệp nhân chủ chi tphcm tổ chức buổi diễn"
921247657930940,"tham gia nghiệm h mọi phần chuyên nghiệp kết thành viên tập chí giải lý sự"
796693227022765,""
1595718864010301,"mọi tiếp biệt chúng tổ chức buổi h quận lượng tham gia gian cách thức nguyễn học quốc hàng tài chi chí minh vui lòng hoặc công viên động nhật"
1525581344429548,"cơ hội tiếp sinh trường thời gian thứ Địa điểm văn nguyễn minh nội chủ nhật học giá lượng thế giới hiện thành thể sự tổ chức viên quốc tế hàng chuyên mọi chương trình nhân tập đề đầu dự tạo kiện liên thông cách trung tâm kinh nghiệm năng biệt công quan lý phí toàn hoặc tài nghiệp khách gia giải dành đăng ký chi tin hệ tư tham"
149304538761869,"chi minh pm vietnam"
1521719851485619,"thể dành chương trình thông tin chi tiết thời gian đầu pm phí thức"
518441461667242,"pm"
927075350720723,"động thành tổ chức buổi sinh nhật chúng tphcm vui kết hợp hãy học biệt viên tham gia tạo năng phát tập thể thời trường tiếp gian thứ chủ Địa điểm phí thông tin chương trình ký"
890966060986998,"nội công sinh gia dụng quan"
441791196018550,"toàn quốc trường học trung nam tế chúng kết sự hiện hàng mang trình diễn"
955677217858409,"nhân gia chúng giá thành viên hội chương trình dụng đăng ký hàng giao thể dự tin"
393788524162895,"saigon"
