event_id,terms
1673153072897440,"giới chương trình hội chủ đề tiếp hình nhật diễn sự nam trung thành nguyễn biệt viên saigon mọi chi tiết liên thể"
403409569850856,"thời gian h chủ nhật Địa điểm trung tâm tạo nguyễn chí minh việt nam sinh tổ chức buổi dành mang vui phần động thể lượng biệt tham gia chi công viên tài hàng thức"
1643882742553367,"quốc gia thức lượng trường phát triển chí nam nhân hội hàng giới chương trình sự động viên thời gian"
1105684389456261,"hội giá dành sinh gia tiếp"
1646169172322185,"buổi giao sự hiện cơ quan tập chí hội thời thế giới quốc lý tạo nguyễn ký"
704613419670791,"saigon"
529715233844807,"tập trung sự thành công dự lý đề dụng quốc tế"
492973564196201,"hợp thế giới khách sự kiện tiếp học chủ đề thức chuyên chương trình tạo dành đăng ký đầu thứ quận tham gia viên tư thực tập cơ hội biệt công trường hoặc phí lượng"
1699270880286806,"pm"
142489732775742,"tiếp chương trình nội thực hiện tổ chức gia nam chi tiết thành viên thứ học tập buổi dành thời gian phát động chí minh sự tâm dự điểm tphcm trung hãy chúng mọi phần thể hình lượng đồng mang tham tài dụng liên hệ vietnam"
347861952089823,"hội tổ chức động dự triển hình sinh viên thời chương trình tạo dụng kinh nghiệm diễn việt trường học thành chí minh văn giao thế hệ tập"
553707154776476,"thực sự hãy cách chúng thể nhân hiện hoặc thế dự đầu tạo cơ hội mọi giới quốc gia"
1044168592280224,"giải dành sinh học tập liên"
1507447266249110,"học tập hãy hội tư trường diễn khách chí minh tạo tham gia chúng giới kinh tế dụng chương trình văn toàn thế biệt kết hợp thực thông tin vui lòng"
677952745575695,"lý dụng hàng tphcm văn thể hình tập chí minh mọi chi tiết vui lòng liên hệ"
725340260922835,"chúng mang hình thành công học đầu hội sinh dành tổ chức sự diễn dự mọi tiếp giải tâm nội chương trình khách văn giao h thứ chi chí minh ký liên hệ tham"
494764264037412,"hội diễn h lý chí minh cơ lượng tổ chức thứ tư gian hàng công khách chúng giới thời kiện nội sự thành điểm mọi tham gia chương trình động giao buổi pm saigon"
420033614863551,"vietnam chi"
411662922360897,"saigon"
1059089314115526,"kết giải tphcm mang trình diễn trường quốc tế công nghiệp biệt sự hiện tài năng tham gia"
181782878833227,"tin chi trường trung tâm phát triển động lượng tham dự phí thời gian h Địa điểm nguyễn quận chí minh kinh nghiệm thể cơ hội tổ chức đầu thế sinh viên toàn chương trình giới"
415560751901803,""
1041025602630712,""
1514846838808883,"chi minh saigon vietnam pm"
775060535938975,"vietnam sự kiện giới giải toàn công nghiệp thực việt nam thứ quốc tế hàng đầu triển khách tham quan gia lý bản năng tư tập trung hội chuyên biệt chương trình đề phần hãy phát thời gian Địa điểm tâm nguyễn văn quận thành chí minh hợp đồng nghiệm cơ lượng thức trường đăng ký hình dụng dành dự buổi tạo thông tin liên hệ nội"
1552412775048787,"vietnam sinh nguyễn minh quận thông tin chi tiết đăng ký tham gia vui lòng"
879336822135979,""
919436231437882,"chuyên gia kinh nghiệm giải cách học thành công trình quốc chương điểm sinh viên cơ hội ký tham sự kiện tiếp diễn hiện trường việt nam thời gian h chủ nhật Địa nguyễn tập hợp mọi tế đăng phần hoặc thông tin chi tiết vui lòng liên hệ tổ chức nghiệp quận tphcm"
1489661418004369,""
1633955313522594,""
721688537965587,"vietnam"
1185663778130472,"kiện giá nhân phần chi phí lòng sự hoặc tin động viên minh hội tổ chức chương trình gian h thứ quận tài đồng tham dự chúng vui tiếp thành đăng ký liên hệ tphcm hàng giao nội"
897885713633701,"chương trình hội thể văn tham dự tổ chức quốc tế giá nhân đầu việt nam đồng mang kinh giới hình gia thời gian Địa điểm nguyễn thức thực hiện tâm giải đăng ký mọi tài vui lòng liên hệ quan đề bản nội phần diễn hợp hoặc sinh chủ trường thế dụng phí thông tin sự kiện"
147543952268126,"mang"
638266769648820,"nhân đầu tạo sự nghiệp kinh bản phát điểm quan tài giải đề công thể chủ động thành lý tế tham gia dự trường sinh viên nghiệm thực mang cơ hội thức việt nam trình chuyên chương quốc tổ chức đồng triển buổi diễn quận tphcm thứ đăng ký vui lòng hoặc tin nội thông học liên hệ vietnam"
1517238981930295,"tổ chức thông thể chúng giải dành chủ nhật mang h giới thời gian chi sinh vietnam tài phí Địa điểm nguyễn cách thức đăng tin"
595595830581398,"kết vui toàn tạo việt nam thời gian h chủ nhật Địa điểm nguyễn công chương trình thực phí vietnam"
426286864233621,"đầu trường học hoặc thời gian thể thông tin tiếp"
874835075904840,"saigon"
850998744998117,"chi minh saigon vietnam pm"
716738678430703,"năng hàng quan nghiệp thành công nhân viên chuyên chương trình mang thức học tâm lý khách giao tiếp tham gia sự cách hợp kết thời gian thông giới đầu hội phát triển lượng h phí ký bản hệ kinh nghiệm tạo tổ chức toàn dành quốc thực dự tế dụng động tin vui lòng liên chúng biệt văn Địa"
703513213082071,"pm"
183580841988156,"thời gian pm Địa điểm saigon giá vui hợp mọi kinh nghiệm thức mang"
747267515322948,"hãy tập hợp nhật"
147933212231456,"cơ nguyễn văn nội tập trung quan thế học giới trường chương trình sinh viên việt nam thông công thực hiện dự đầu tin phí buổi"
910529609036509,"sự kiện động sinh phần đồng thông tâm cách cơ hội quan biệt thế thể hãy thời gian diễn h chủ nhật thành Địa điểm minh lý liên hệ"
1510567955909044,""
764835670294999,""
855071091220515,"tphcm nghiệp toàn bản minh chuyên cách trình khách hàng kinh nghiệm thông tin phí chúng đồng phần tiếp chi kết lòng sinh viên thức học hệ tạo văn trường thứ chức lượng thời gian công hãy diễn giải thành mang tâm giá sự hợp dụng"
487623601362936,"saigon pm"
182047475468283,"bản phát hội việt nam tổ chức buổi nghiệm thời gian dự diễn chủ nhật điểm chí minh chi tiết sự lượng tham gia hợp nội chương trình cơ giới giao phần đầu giá hàng tphcm mọi động thành công"
103101450054306,"công Địa tổ chức sự kiện giới hàng dự triển hợp phát khách cơ hội động chương trình buổi diễn giá dành tham thức biệt hãy đăng ký"
1052922628086084,""
1506351686359278,"thế động chúng vui tổ chức kết hợp trình dự tập trung phát thành kinh phí tài hàng nguyễn việt tin tham gia liên hệ"
1520387614946767,"vietnam"
1654035388177889,"tập thể quan hệ tphcm hội thực tế phát động giải giao gian trung h chủ nhật đầu gia quận tham dự biệt nam thành viên công quốc hoặc nhân đồng toàn liên việt nội phí tổ chức kinh đăng mọi sự chi lý sinh vui lòng thức dụng hiện điểm tiếp lượng hợp trường tài trình thông tin nguyễn chuyên minh"
1036612783035948,"tham gia giao kết đồng thời gian dự đầu buổi vui sự liên hệ"
800361323357823,"khách hàng đầu tư dự trung tâm tphcm thông tin hoặc thành văn hợp viên vui lòng liên hệ triển"
1660552524216133,"đề quan tâm hàng đầu thế giới tổ chức tế phần tạo kiện đồng cơ hội phát hiện dự lý công thông hợp chương trình trường tư phí liên động sinh chủ dành khách tham chuyên gia viên toàn tài buổi kết tiếp vui lòng cách đăng hoặc tin thành ký nhân thứ thời gian h mọi hệ"
1656182334649628,"năng hàng giao tiếp lý thời gian"
1053742441317347,"diễn tư kinh quốc cơ hội giao tế nhật tin hình phát triển tiếp thông nghiệp chủ việt nam lý chi tiết chương trình phí tham dự vui lòng liên hệ"
644598465643953,"nhân thành đồng tphcm dự tổ chức buổi giao hình quốc gia chủ đề kết thời gian Địa điểm học hợp lý quận phần tham chuyên sự chương trình khách phát động giới hội diễn văn thức viên tiếp kiện hoặc quan tâm đăng ký nghiệp việt nam triển"
1591204524467956,"vietnam giá chi minh"
435322593338815,"saigon"
737090809728395,"chủ năng gia trường tạo chuyên phát triển kinh học thực tế thể dụng kết hiện tham dự nghiệp lý nhân hàng chi tiết chương trình tin công quốc tổ chức mọi cách tư buổi hội thế giới diễn phần tài biệt thời gian nghiệm tâm việt sự thành sinh động tiếp liên tập trung quan lượng giá thức điểm khách đề giải hình đầu thông chúng hoặc giao hãy lòng dành bản"
516363538546016,""
1708970406004977,"diễn việt nam vietnam sự kiện tập hợp tạo đồng thức phát triển hãy đăng ký tham gia đề thực hội giá nhân nghiệp tin thời gian h thứ Địa điểm phí dự dành học viên sinh"
528961267266179,""
405987992930610,""
1647784098809527,"tphcm thức sinh minh dành mọi đầu học h thứ biệt viên dự cơ hội tham gia tổ chức liên hệ chúng sự thành đăng ký buổi nội bản thời động kiện cách tạo tiết dụng hợp thực tư chí hình thể tin hiện phí mang lượng chương trình quận nhân hàng chủ nhật hoặc tài việt nam thông vui lòng nghiệp chuyên kinh nghiệm công saigon giao"
864041886997217,"saigon pm"
439904049551763,"tham tạo kinh nghiệm thông tin thức sự nghiệp buổi chuyên gia tiếp chương trình chủ đề năng bản đồng thời công thành dụng thế giới giao phát cơ hội động cách thực hệ quốc tế thể hiện tài đăng ký gian h phí dự Địa điểm saigon quận"
1706173342932599,"saigon pm"
105330416502936,"tphcm chúng điểm thông mọi động thứ"
134546073570468,"học liên h buổi Địa điểm viên lý nghiệp năng hợp toàn kết tài quan hệ giải trình hàng dụng thực hiện dự chi phí thông tư nội giá gia phát sinh công thành tiết động hình kinh trường tiếp kiện chuyên thế hãy thể tham đồng tế bản cơ mọi chương tập tổ chức hoặc tạo nghiệm nhân sự mang"
928894690519883,"tập trung sự thành công dự lý đề dụng quốc tế"
692497527518304,"pm"
979761405403606,"sinh viên cơ hội thức bản nghiệm thực tế dự đồng văn thế giới công toàn năng hãy chương trình mang học đề quốc gia tổ chức buổi chi tiết tiếp tập thể đăng ký tham sự kiện tin thứ Địa điểm nguyễn tạo tài hoặc"
1674089026164377,""
1054725234546881,"mọi thức cơ hội tập kinh nghiệm công chúng đầu tphcm hiện thời điểm dự giới thể tham gia thông tin đăng"
533717493449855,"dự tổ chức kinh trường tphcm động hội thành dành chủ đề mang sự lượng giá văn đồng tham gia học sinh viên chí minh trình tế thời gian h Địa điểm cơ giao toàn liên hệ thông tin chi tiết diễn tài trung tâm"
1118660994820141,"saigon vietnam pm chi minh"
441028849432114,"chi minh"
942145629156651,"động đồng diễn công tổ chức giải mọi nội chi tiết cơ thể thực hội quốc chuyên gian hàng chương trình toàn phí"
1147882738564437,"thức sinh dành đầu h thứ tphcm học viên phần trường hội điểm tạo kết hiện thực thời gian thể buổi cơ bản toàn phí đăng ký sự chuyên gia tư nghiệm chương trình biệt hợp việt dụng năng động thông chủ đề kinh nghiệp nhân nam chúng tin mang mọi hình cách nội giới tài chi tiết lượng quan triển tham giá nhật thành vui lòng hoặc lý đồng quận hàng tiếp liên saigon giao Địa"
177405102602025,""
520105564831146,"kinh giao tiếp văn thể nghiệp nghiệm sự quan hệ hợp việt nam nhật bản trung tâm nhân tổ chức hội học viên thông tin chi tiết"
427770110749644,""
1477651862560133,"saigon vietnam"
1638389173109087,"nhân diễn hàng năng thành mang quốc tế học thức kinh nghiệm chí thực gia phát triển mọi thời quan cách tâm sự văn động tạo tài chúng biệt giới việt nam trường gian kết chuyên chương chủ nghiệp nội công tập cơ hội giao hiện dự dụng lòng lý dành đồng tổ chức trình minh đề tham liên điểm tiếp phí khách viên vui hệ h quận"
576649295807118,"tin hội học đồng kinh tế dự thành sự toàn nam tạo trường cơ quốc gia viên hàng đầu tư động phát triển cách công năng thể tập trung tâm việt tổ chức lượng chương trình nghiệp tài dụng mang hợp tphcm tham thực hiện chuyên thế giới hoặc liên hệ"
1050129005007402,"liên kết tham gia hãy Địa điểm nguyễn quận thời gian h chủ nhật đầu giá thành viên dành hàng công biệt thể hoặc vui"
1530136120643016,"tham gia vui trung chương viên mang sinh liên thông minh tphcm chúng động trường học giao văn quốc tế thành hiện thực tin giải thể kết bản việt nam giới sự đồng tư tổ chức cách phát dụng tiếp tập hợp hoặc hình hội quan tạo điểm tâm dự hàng nội thức nhân chuyên chủ cơ tài kiện giá đăng ký năng kinh diễn thế"
541688985990207,"hình động quốc tế tổ chức thứ thành thế giới đầu diễn sự mọi nội tập trung h trình điểm kết nhân tphcm pm"
410271959178819,"hội giá hãy buổi thứ thể"
534708873350828,""
1522705568048224,"thời nội sinh hình cách hoặc thức tư mang vui sự vietnam tổ chức chương trình h chi tiết tập trung công dụng thể thành điểm thực hiện động diễn đồng giao phát kết chúng lòng tâm học mọi liên tham gia tài"
1659305187682471,"học thứ h chi tiết Địa văn chí minh nguyễn cách thức hàng toàn động dụng công hội kinh khách mang năng biệt viên thực sự chúng chuyên nghiệp thông tin hình liên hệ"
1623749834542763,"sự kiện năng giá công tạo mọi thể tiết đăng vui lòng lượng nguyễn nhân nhật"
1667516100192564,"sự động thế giới hình thức giao tiếp tin nghiệp mang nhân viên khách hàng hãy chúng dự thành chủ thời hiện"
1663241800631364,"năng lượng sinh cơ thời gian thể tiết tập trung học thành công sự tin bản trình tâm đề chí quan vui chi"
478515825661630,"thời gian thứ Địa điểm nguyễn vietnam thông tin chi tiết tham dự hoặc lý nghiệp ký"
1045203018844119,"chi minh saigon vietnam pm"
978023902255856,""
977812568945998,""
1705848732980878,"chương trình hàng khách hình học thực tập đồng sinh viên việt nam trung tâm tạo trường cơ hội dụng thức tế kinh nghiệm bản hiện biệt thể phí cách đầu quan thông tin giá kết mọi chí minh dành thời gian chủ nhật Địa điểm nhân quận chi tiết tham dự hoặc tư tiếp nghiệp quốc hãy đăng ký"
1526600467663466,"chi minh vietnam"
1502150523415752,"tin sự trường động thể dụng nhân cách"
932318536854763,""
1652546251661088,""
1534172186874420,"chủ đề quan tâm biệt động hiện kết thành toàn thể hội điểm cách phát thực tế giải thức thế hệ triển chương trình tạo chức năng lý thời pm học Địa quận"
1004501272934293,"kiện giá nhân phần chi phí lòng sự hoặc tin động viên hội kết hợp kinh sinh phát tổ chức chương trình gian h thứ quận tài đồng tâm liên hệ tiếp hàng chủ minh nam ký tham gia vui đăng"
555065451317943,""
1651302205118023,""
1635667590055386,"thời công hiện thành phần thể hình toàn hoặc chi phí lượng nội chúng tiếp tham gia nghiệp phát quan động kinh giải buổi tổ chức biệt trình hàng khách trường hợp việt nam thế giới diễn nguyễn nghiệm chủ tạo nhân thông liên kết bản viên quốc tế dụng"
1719877178240884,"đăng ký trường chí minh sự kiện tổ chức thông tin chi tiết"
1500362113591255,"saigon pm"
210616589269733,"nam tphcm phần động viên thành tham gia chương trình thông mọi lý đề hội quan tâm diễn kết toàn phát Địa điểm chí minh thời gian tổ chức lượng kinh phí chi cơ công hoặc h pm tập trung sinh nội thể giá"
182639612078173,"pm vietnam"
871565706285002,"saigon cách gian hãy"
1097659073578691,"giải quốc tế"
138048423223427,"saigon"
1658552184361587,"nam hàng kinh thế giới tâm nhân thành chương trình tạo tiếp lý công quốc tế nghiệp toàn chuyên chí minh việt thời lượng thực dành hiện học năng dụng đầu gia giao chi phí sinh mọi trường giá chủ đề phần hoặc tài nghiệm khách tiết biệt buổi tập trung quan liên bản động thể mang kết tham"
1516099898705226,"chương trình tiết hàng đầu quốc tế diễn cơ hội phần tài học kinh nghiệm hợp chủ giá đăng ký tham dự thời gian h nhật Địa điểm nguyễn"
1465104253792971,"hội đầu tư việt nhật diễn tphcm nghiệp bản cơ nam"
1642763619333249,""
1648346515421234,"vietnam saigon"
1621361011463261,"thông tin thức buổi tập chủ đề mang diễn học văn mọi hãy nhật hình sự kiện"
764871663617846,"tổ chức buổi tư phí chi tiết thời gian thứ chủ nhật Địa điểm thành quận nội đề giải tham gia năng quốc tế chúng đăng ký đầu thông sự kiện phát vui lòng mang"
499879156840400,"tham tổ chức mang nghiệm dự chi tiết thể bản liên hệ lượng công mọi vui lòng giải"
868113803286255,""
778607978933665,"vietnam"
1629089714006339,"hội saigon pm sự quận thứ thành"
939638432739841,"giao tiếp quan hệ kinh nghiệm dụng thức lý thành năng thực gia sinh giải hãy ký mọi đồng học công tạo trường tế biệt dành tâm chương trình phí giá đầu đăng tham"
1524682541185172,"giá đồng giao ký hàng"
962375430501761,"saigon thể hãy tập chủ nhật hàng thời gian đầu vui lòng đăng"
555949701234891,"kinh tế trình thành quan mang công nghiệp hiện trường sự biệt nhân viên tổ chức tạo dụng đề liên chương lý thể phát năng cách cơ bản tài triển giải tin gian học chủ nhật thời h lượng buổi kết nam quận chi phí thông tiết đăng ký vui lòng hệ"
441629796036509,"cơ hội việt nam giao hãy đăng chúng phí tài hàng chi chủ khách"
116156808747985,"chuyên gia nhân sự giá công cách quốc dụng kinh nghiệm mang lòng ký hoặc tư"
141278542901395,"chi minh saigon vietnam pm"
1643381175903642,"thời gian chủ nhật Địa điểm hội trường quận chí minh việt nam phí tham gia lượng giới tổ chức chi thực nội chương trình văn sinh viên hình mọi vui lòng liên hệ hoặc"
600827433383056,""
1405303876431734,""
438894969641721,""
482838738558603,"chúng vui thông bản hội dành động saigon quận tài năng chuyên nghiệp tham dự trình diễn mang sinh chương giải triển đồng hãy tiếp tin thứ chủ nhật thể vietnam nam kinh"
1516517512002547,"đăng tham gia nhân thông tin thời gian h Địa công tphcm"
875491222558206,"hàng tham gia hội chương trình"
1697241207153927,"chi minh saigon vietnam pm"
1636419359964472,"chủ nhật thời gian"
1651687241722923,"tham gia trường kinh tạo hàng đầu thế giới cơ hội tiếp sinh học thành công dự phí thông tin kết viên triển quốc tế tổ chức chí minh vietnam thứ saigon quận giá dành khách tài nghiệp chuyên trình nghiệm quan tâm h chi tiết vui lòng liên hệ việt nam văn nội"
995025613883488,"saigon hội hình thành đồng công tổ chức gian nhân trình lượng mang chúng tiếp giới sự kiện diễn chủ nhật"
983628185032105,"mọi vui lòng liên hệ chúng nội"
197446043924959,"saigon h"
1642044482711178,""
187063218296622,"nhân diễn sự đồng chương trình năng phát viên tham công gia thành hình tiếp hàng thời gian tạo buổi tphcm thông hội việt nam chi nghiệp lượng dự thứ h Địa điểm tâm lý nội sinh thể tư thế hợp giá chuyên phí học ký tập dụng đăng phần mọi tiết vui lòng liên hệ văn"
1084051461628235,"chi minh saigon vietnam pm"
1226313327396867,"mọi tiếp lý"
719368461526737,"saigon pm"
1495218810806969,"chương trình tổ chức động mọi hình thức đăng ký tham gia tập diễn thứ h thông tin liên hệ"
464495213732121,"nhân thông tổ chức thời gian Địa điểm dự văn thành phần tham giới chương trình sự nhật đồng nghiệp quan chúng chi tiết vui lòng tin"
1656348561311152,"h"
1488463164790626,"biệt dự tập thức trung tâm tphcm đồng thời kết tiếp thành lòng công viên mang cách tạo gian chủ nhân hệ hàng đầu tư sinh nhật gia điểm nghiệm dành khách thể hiện tế vui toàn liên lý giải quốc trường lượng tổ hợp việt nam quan thế giới chí minh động hình văn mọi sự kinh"
1653260184922609,"tiếp mang động trình diễn thời gian h pm"
496623987186051,"khách hàng dụng trình"
1648464892085939,""
250309228458366,"trung chúng thể phát động tổ chức chương trình lòng thời gian thứ tập h chủ nhật Địa liên gia dự phần tâm hãy hệ tin tham đăng ký nam thế kết phí"
1647213525551952,"thành công buổi việt nam tổ chức phần mang học viên hiện khách tham dự nghiệp tin hãy gia chúng thứ thời gian Địa điểm quận chí minh giới vui lòng hàng đầu sự tài kinh trường toàn vietnam pm chi"
423717384415158,"chúng tâm trung hãy vietnam mọi gian ký thời vui phần tạo kinh phí chương trình dành gia hội tổ chức thứ tin h Địa điểm giá đồng hoặc liên hệ cách"
806269369499422,"chi minh saigon vietnam pm"
730495743749028,"pm điểm saigon động tập thời gian thể"
197038423962760,"thời gian điểm lượng hội trường học diễn mọi tphcm giá nhân hợp sinh viên tổ chức mang sự kiện tạo cơ thể đồng tư h Địa văn đăng ký hoặc tiếp chi tiết liên hệ"
1513308675646827,"học công tâm chuyên gia viên thức thực tế giá trình việt nam tạo nghiệp quốc nội tiếp thành tổ chức ký mọi chi tiết liên hệ hoặc hình"
1723028394595042,"hội học cơ gia trung thể cách thức thành công trình giải buổi chi tiết thời gian Địa điểm quận tphcm sinh viên"
423109224551631,""
515513515294126,""
910059795737600,"phí tham gia nam đăng chương thông tin ký biệt dành quan cơ hoặc giao nhân viên diễn chuyên tâm gian pm văn tphcm tiếp công lòng sự"
986456478078557,"sinh giá thể khách hàng nhật bản chương trình dụng hệ thức tiếp hoặc nội quận thành vui lòng thực hiện h"
538279132989832,"thời điểm quan kinh tế việt nam hội toàn đồng trường hàng biệt đầu thế giới nghiệp thức động cơ tiếp hiện chuyên mang ký tham dự chi tiết chương trình học"
1653992801547099,"học sinh viên quan tâm chương trình vui lòng tham dự hội tiếp trường thứ quận tphcm đăng ký hoặc hiện toàn giá thế giới thành việt nam điểm lý"
1483086508637055,"học phí trường hợp cơ bản buổi liên hệ quận thứ nguyễn văn lượng chủ nhật mang tập mọi giới thức năng nam"
1487338478240415,"mang tài năng thứ thế giới tổ chức thành công nam lượng buổi diễn thức sự kết hợp tập trung bản thể tế chương trình hệ điểm thực kinh nghiệm hàng đầu toàn cách pm phí"
1527444727569728,"hàng"
1447016085626611,"vietnam saigon"
470419469805037,"thời gian sự tham gia sinh học việt nam chuyên tư cơ hội phần chương trình dụng nội đề giới kiện chi phí kinh nghiệm minh tài thế ký tiếp"
991726190899697,"nhân khách hàng nghiệm lượng chúng chi phí"
930395153664597,"saigon pm"
1628876144040385,"saigon chi minh vietnam pm"
1645651059017140,"chi minh"
1521483178178527,"sinh hãy chúng nhật nghiệm thế giá toàn dụng thực hiện vui lòng giao năng tạo học thời gian Địa điểm saigon"
965011166870264,"quốc tế công gia việt nam"
1640441632884917,"saigon pm"
1516028465387070,"công nhân chương cơ saigon thông tư liên minh tham gia đăng"
