event_id,terms
892525794172238,"tham gia chương trình hãy tiếp sinh trường học hàng đầu tạo thông tin quốc hợp nghiệp triển tế tổ chức chí minh vietnam viên dự thứ saigon quận giá dành khách tài chuyên hội kết kinh nghiệm quan tâm thế giới chi tiết vui lòng liên hệ việt nam văn nội"
1630899993845932,"cơ hội chương trình học tập dự tiếp nhật bản thông tin trường tham thành công"
463742797039474,"chủ thể kiện năng lý chuyên hợp kinh tế biệt đề thành viên sinh hội tham gia"
750748281714728,""
866111476835677,"tổ chức tạo phần đầu tư trung tâm đăng học viên ký kiện tham dự kinh nghiệm thời lượng buổi Địa điểm nguyễn minh gian h thứ chủ nhật phí thức"
1648912038721600,"pm"
1100199796676321,"saigon"
1643243845945814,"thời gian h thứ Địa điểm trung nguyễn quận tphcm vietnam chi phí bản việt đăng ký tham gia cách"
1489867771318674,"động mọi tổ chức phát cơ điểm lượng phần tham gia vui lòng đăng ký trung chí minh dụng thể hoặc giá thời gian tập thông"
449208315279813,"vietnam"
1468796560095962,"saigon"
1862289050664286,"saigon giới thế kết cách tạo sự đầu biệt tập trung phát triển tài năng thời điểm trường nghiệm tham gia hợp trình diễn thành gian quốc tế tiếp viên giải dự toàn động dụng hình kinh hiện"
531123497045760,""
1539218623005421,"hãy saigon buổi năng lượng chúng tạo đồng điểm vui giải thể giao kết giá thức hoặc trình diễn chương dành phí tiếp nghiệm đầu thời gian pm Địa quan"
1006126902778254,""
1479367552373148,"pm"
571688909651350,"saigon pm"
922971211103579,"saigon pm vietnam"
189292908073143,"hàng chương trình gian h chủ nhật quận tphcm đồng minh tâm sự kiện nhân văn mọi thể hợp viên lòng hội buổi giao kết chúng tài thông giá thực hiện gia học thời dự giới tiếp tổ chức khách vui liên hệ nguyễn chí tin"
772348176227890,"chi minh"
931755086907392,"minh"
1542894519335025,"chi minh saigon vietnam pm"
925268004218508,"giới pm thứ khách biệt thức hoặc cơ hội thông tin"
367323636758059,"tphcm nghiệp"
1654656524793572,"công vietnam khách hàng tham dự buổi tư tiếp Địa quận ký vui lòng đăng"
475090992616222,"chi minh vietnam"
1676521435919011,"saigon"
587786681361995,"nam tham gia"
867754930012766,"chương trình hội chi tổ chức chúng khách hàng thức mang bản sự nhân sinh viên học tập thành"
321142341389788,"tham gia thành chương trình học việt thế hệ viên thời gian vui sự nghiệp diễn hãy kết chúng giải thể nhân tập hình hoặc tổ chức chí công tphcm"
1713200985567912,"liên văn sinh nhật tổ chức h chủ Địa điểm nam đăng ký tiết giao chương trình"
1631223837143296,"h"
171696766513692,"cách tphcm giới thành hình đồng trường công hàng phần chủ nghiệp lượng mọi thứ hiện toàn mang vui tạo tổ chức chương trình thời gian h thể đăng phát dụng học tập sinh văn buổi năng tham gia chi dự dành kinh hoặc sự tiếp tài lòng tin thông nhật liên hệ quận nguyễn hãy tâm kiện"
614073462063699,"học sinh tham dự buổi tiếp thời gian h Địa điểm văn nguyễn quận tphcm đăng ký viên cơ trường tạo năng thực bản cách trình đề sự tin giao chương thông tư dụng nghiệp thể việt nam giá liên đầu thứ toàn thế giới đồng thành hiện tài công hoặc hàng quốc tế lòng lượng tổ chức chi"
729294240471925,""
182401922107555,"quan chương năng học tập cách chúng tiếp thông tin động trường viên khách hàng thể minh kết hình hoặc hãy lý tạo phát triển công trình giải đề việt nam thức tài tổ chức nội thành biệt mang toàn vui thời gian trung diễn tư hợp chi"
1051599734892435,""
424468137738057,"nội chương trình ký tham gia hội nhân sự việt nam giá tài kiện chủ đề chuyên động dành khách dự nguyễn quận quan triển giải hình thức đăng thời nghiệp gian hàng"
926958700717655,"saigon việt nam"
406829072835666,"hội quốc tế việt nam thứ thành chí minh vietnam chi công tổ chức đồng thời triển kiện trung tâm nguyễn văn quận quan nghiệp biệt gian hàng gia nhật bản tạo cơ hợp kinh thế giới phát chuyên liên tiếp động trình dụng thể hiện trường tiết năng lượng phí thông sự chúng đầu tư kết hệ giao tham thực mọi nghiệm lòng dự khách"
1519232068389259,"năng cơ hội thể hiện bản hãy trình diễn động phần giải tham gia chương"
1708577069371002,"thể hiện bản thời gian"
1521978201451195,""
592475197557492,"tiết chi phí thế tham gia chúng thời gian Địa điểm trường động giao h toàn liên hệ"
546487338833694,""
1124651970893393,"thời gian nội đăng"
523399524503134,"gian học thứ chủ nhật thời lượng kết nam quận chí minh chi phí tài viên mọi thông tin tiết vui lòng liên hệ phát triển kinh nghiệp nhân trường tạo việt quan tâm đầu trình sự thực chuyên hiện dụng lý nghiệm giải gia chương mang công tập hàng thế giới động khách giá thành tổ chức năng"
407965239373341,"chi minh vietnam"
1075900679094831,"chi minh saigon vietnam pm"
1523121838001924,"chủ sự thứ dành mang năng phát triển tế lượng thể diễn minh buổi biệt chương trình đầu pm"
1658388237753858,"việt saigon pm giao văn chúng quốc gia mọi tiếp hàng quan hệ thực tham thế hãy đầu cơ bản sự kiện phí dự khách biệt thức h thể thông tin diễn giới thứ"
1749003568652441,"thành viên hợp kinh thể đồng liên hệ tư"
918815728153625,"thức công trường việt nam"
1642998415970980,"vietnam pm"
712009595602015,"mang điểm cách thức dụng giải liên quan hệ bản dành tổ chức buổi h chương trình nghiệm toàn phí nội nguyễn quận chí minh văn biệt khách hàng tham gia giá đồng thông tin chi tiết"
1722593361302843,"dành bản hãy tham gia sự kiện học chúng nghiệm thể mang thức Địa điểm saigon nguyễn văn quận chí minh thời gian thứ dự chi phí đăng lượng"
1049794151708209,"tạo hàng đầu thế giới phần tiếp thông năng hoặc bản tin hợp thức thực động sự hãy tâm trình chúng tế chuyên gia kinh nghiệm lý nghiệp hội nam buổi toàn biệt công dụng tư học nhân kết mang viên hiện tài phát triển khách đồng kiện diễn thứ gian Địa điểm nguyễn văn quận ký tổ chức"
631160783635286,"chuyên giá hàng công tphcm toàn quốc thế hội động khách văn thể hình tập chí minh hãy tâm lượng trường mọi chi tiết vui lòng liên hệ"
727351294066130,"kết hợp hiện viên trường văn tphcm chủ quận sinh học thứ thế hệ cách dụng công đồng gian tiết hàng dự đăng giá phí thể mọi liên nguyễn tham nội tài chi thông"
816406775135427,"công Địa tổ chức sự kiện giới hàng dự triển hợp phát khách cơ hội động chương trình buổi diễn giá dành tham thức biệt hãy đăng ký"
1002359466476664,""
1014810091916125,"tập trung sự thành công dự lý đề dụng quốc tế"
1509742802677307,"quan tâm hàng đầu nghiệp tiếp thời gian giao chi phí thức hiện thể khách cách hợp lý giải đề công chuyên gia học thông tin tiết"
1041164115934282,"sinh nhật thành viên liên kết hợp tổ chức buổi biệt chúng nhân thể giao thông tin thức thời gian h chủ Địa điểm hội trường nguyễn minh quận chí giá tham dự đồng mang gia phần cơ dành đăng ký chi tiết mọi hệ cách tiếp"
963246437103211,"thứ sự kiện gia hàng động"
524628811027230,"học liên h buổi Địa điểm viên lý nghiệp năng hợp toàn kết tài quan hệ giải trình hàng dụng thực hiện dự chi phí thông tư giá gia phát sinh công nội thành tiết động hình kinh trường"
963139843743501,""
1639524949632281,""
423555677848446,"tham gia giải đăng ký hoặc sự kiện động phần hàng tổ chức học phát triển nhân dự thực tạo thành viên bản công thông tin lượng việt nam năng quan thế hãy thể"
326413324149212,"tập tạo hàng khách đầu thế giới trường lý chương trình lượng kinh nghiệm giá sinh hợp học tư thực trung điểm dụng nghiệp viên quan tâm hội thông tin kết mọi chí minh dành thời gian thứ Địa nhân quận chi tiết tham dự hoặc tiếp phí cơ kiện"
902310349847187,"saigon vietnam"
947821865304797,"thông tin chi tiết diễn liên phát nội nguyễn học trung tâm văn tphcm thành"
785083881617402,"saigon vietnam chi minh pm"
483455978483118,"nhân sinh nhật buổi dành phí đồng Địa h lượng phát tiếp tham gia"
1676106492658615,"vietnam chi minh"
506193636215894,"sinh minh thời gian Địa điểm công viên tập trung chúng tham gia dụng tâm mọi hoặc nhật buổi động thông"
964558963605182,"nghiệm giải thực tế cách tư phí chuyên gia nguyễn quốc diễn viên minh trung tâm thứ chủ nhật"
974436035949153,"pm chi minh vietnam saigon"
491548331013231,"saigon"
405973212925585,"chi minh vietnam gia saigon pm"
1733682646859766,"thức tin tạo hợp sự hãy mang toàn trường tham gia kinh tế chuyên tài hàng năng lý trình chúng nghiệm hệ nội giao đề nhân phần kết điểm thời gian chương chủ giải đồng giá học giới công tư trung tâm nghiệp việt thể thông chi tiết cơ văn nguyễn hoặc dụng mọi vui lòng liên"
394713817404679,"học buổi thứ lý bản sự kiện thực quan hệ hoặc năng lượng dành sinh thời gian đầu thể tham gia chi phí đăng ký giao"
103780789985311,"nội bản lý toàn thông chi phí h"
1033124196708995,"chủ đề sinh diễn thời gian h thứ hình thức gia"
905689322853637,"tiếp chương trình gia hàng dự tổ chức h tập trung thể thành công phần phát thông chúng sự viên tâm hãy động giá liên tham tài vietnam"
758281127610735,"kinh liên quan biệt sinh giới mọi lượng hiện chương trình phát tiếp thứ hàng đề tâm cách kết"
558200800993681,""
505632049618301,""
429444030594966,"mang sinh viên buổi hội trường quốc tế kinh nghiệm lượng tạo giá cơ thành chương trình học liên thông dành kiện hoặc biệt bản khách hàng công thực tập hãy tham gia diễn thời gian pm Địa điểm văn việt nam quận vui lòng đăng"
1640768362814765,"ký tham gia hội việt nam sự dành giao trình chuyên trường chúng kinh nghiệm toàn đầu tư phần tổ chức cách lý tạo thế giới hình động giá phát triển học năng cơ giải tài phí lượng đăng thời gian pm Địa điểm khách nội bản thông kết mọi chi tiết liên hệ"
736325763177454,"phát hiện công thức biệt dụng dành hãy tham gia sự kiện học chúng giải bản mang cách đăng vui lượng dự giới phí thực thời gian thứ Địa điểm saigon nguyễn văn quận chí minh"
1164280260255705,"hình thực tế đầu lý hàng dụng giá thứ nguyễn công quận mọi tham kết biệt hãy gian"
468976873302611,""
502091833300263,""
621984551194427,"công chi tiết nhân dụng biệt kinh thể hiện sự dành giới giá tế mang cách"
1653688341538912,""
398686067005910,"việt saigon pm chi minh vietnam giới thứ thành điểm đồng nam khách diễn động trung tâm quận hàng chúng h tạo sự kiện bản thế giải dành cách vui công giá lòng tế thức biệt phí thể gian thực đầu quốc liên chí thông tin tiết"
617788491694733,"saigon vietnam pm"
2147949678679083,"đầu hội động mang vietnam tổ chức diễn hàng dành toàn hãy tham gia sự kiện trường giao gian thời hình việt nam nguyễn tâm nhật nghiệm thông tin đồng năng lượng tạo phí bản thể giới thứ tư Địa điểm thành quận tphcm giá tiếp học hoặc tập trung chi minh"
931978370186855,"chương trình sự thực tế triển công hội viên chủ đề nhân tham gia nội giải tổ chức thế dành đăng ký thành hoặc khách hợp văn thời lượng cách thức hàng hiện gian h thứ Địa điểm"
728667207277026,"thành động phát triển đồng việt nam tạo kiện viên giao kết tổ chức buổi lý quận thể tham gia thông tin thời gian h Địa điểm phần chúng"
1677137379195108,"thực sự giá chúng toàn hợp dành thể hàng tổ chức chương trình động chủ đề vui giao kết thời gian Địa điểm nguyễn tphcm nội tham gia thức học tạo phí dự viên lượng lòng đăng ký trung tâm mọi liên hệ tư"
468807196637000,"tài toàn quan tâm hàng đầu học công chức năng nhân sự kinh thể lý chuyên biệt dành hội thức gian chủ nhật thời h lượng buổi kết nam chi phí viên mọi thông tin vui lòng liên hệ thành chương trình nghiệp cách tổ hình điểm dụng tư thế"
503234193169664,"hội quận tphcm việt nam"
1108946245804839,"văn thời gian học thứ h Địa điểm chí minh nguyễn thông tin chi tiết tham gia hàng kinh cách giới công khách biệt tiếp vui viên chuyên nghiệp"
1645416069063738,"sinh viên tham dự chương trình công vui lòng tiếp hoặc thể liên hệ thông tin buổi lượng"
973469002664833,""
614363315369846,""
133798883645899,"sự thành công hội nghiệp chí minh tiếp hợp nam tổ chức tạo vui giải sinh thời gian diễn Địa điểm trung văn tphcm hàng thực gia dụng tham giao khách quan cơ lý tâm chương trình lòng liên hệ việt quận"
136941413335064,"thức dành trình thông chi tiết tập tiếp điểm hình sự kiện thể tham gia hãy sinh mọi buổi"
1517252088592543,"lượng ký thời gian thứ Địa điểm thông thể phí tham gia phần thức công tổ chức biệt khách dự mang bản dành sinh viên nội buổi trình diễn chủ đề học tập thực hiện chương hình mọi vui lòng liên hệ minh"
519090021584170,"nghiệp tham dự nhân phần giải giá động"
1398181920473000,"thứ thời gian Địa điểm trung tâm hội quận tphcm liên hệ mọi cách lượng khách nội nhân cơ bản đăng ký tham dự"
769324746530708,""
522359454596124,"tài thức lý cách đầu thành kinh nghiệp công sự tham gia minh tư việt nam hàng học tế chương trình nhân cơ bản dụng dự tập thể mang giá thực hãy kiện"
822077791243799,"mọi tham gia tổ chức động dành tphcm thể mang thức thời gian giải hàng sự kiện diễn nội toàn thành viên lý h chủ nhật"
654461881357842,"học sinh viên nội chương trình giải liên quan thời gian chủ nhật Địa điểm hội trường quận minh"
1284046531620841,""
942502089120677,"quận tham gia trường sinh thức cơ hội thành đầu việt nam kết hàng hãy thứ tiết h biệt buổi công nội tphcm"
186513501688889,"chương trình dành kinh thế công hình hợp việt nam"
805936946171777,""
543875712442279,""
1634561066796800,""
1665348500389983,"đầu sinh nhật thông thức tham gia cơ hội nam giao chúng dành buổi dự tin chí minh Địa điểm công thời gian chủ lượng phần cách tiếp hàng thể vui lòng tài diễn hoặc trường hợp hình nội đăng nguyễn chi quận tiết liên hệ"
1207592255933943,"chi minh"
509992435843792,"tham gia hội mang chủ đề cách động bản dành thời gian sinh viên thành hiện thực tập thể giải vui phần thông tin chi tiết thứ nhật Địa điểm phí hãy hình thức thế tư dự buổi đăng ký h"
843714479079121,"kết kinh nghiệm chương trình sinh viên tạo quan hệ hội đồng học tập công chí minh nhân tổ chức sự hình thành phát thế năng phần triển động tphcm"
792202657568490,""
122286908135599,"liên diễn tphcm phát thành quận hoặc văn"
352365844962785,""
372325806279445,"tin thành viên đăng hình ký tham gia"
1727916837436720,"thể thế giới tạo hệ quan thông tin hội hoặc cách chúng đầu thứ giá tham dự học thời phần cơ bản năng tiếp mang kết hãy đăng ký saigon gian sự tâm"
665696516910156,"cơ hội chương trình học tập dự tiếp nhật bản thông tin trường"
1233042353454614,"hiện nhân viên chuyên chúng mang tin sự tâm"
551919804971896,""
686337388133063,"vietnam chi minh"
1300065630019579,"việt thứ đầu nghiệp hãy phần phí liên hệ chúng hoặc tin"
1058521250847143,"nhật thông tin động tphcm liên minh sinh tham gia"
830956830352088,""
1629460350652117,"cơ hội đầu tư sinh kết giao nội thể sự kiện dự thành Địa điểm trung tâm thời gian giá thông tin đăng ký tham gia vui lòng liên hệ chúng chi tiết chuyên viên lý nguyễn tphcm"
1517804545199422,"chương trình diễn chuyên đề sự tham gia học viên thông tin chi tiết buổi nhật"
934165203347159,"Địa quận thành chí minh việt nam liên hệ phát triển kinh công quan nghiệp chúng thể lý mang giải thức thời nghiệm thực thế lượng nhân viên chương trình dụng chủ động tế sự học toàn giao tập hợp năng dành hàng tham gia phí tài đăng hình cách cơ hội khách gian tạo giá đề tiếp thông tin chuyên"
505814529591768,"việt vietnam hợp dự tạo hình bản thể hiện trường cách dụng động nam quốc gia sinh thành viên triển chí minh"
807337756046826,"tphcm chuyên đề tập động công chúng triển giới tài việt nam nguyễn gia văn thông tin thực hiện dụng thời đầu mang thế cách tạo hình minh kinh trung thành thể biệt tiếp bản"
1650607558527327,"chi minh vietnam saigon"
380347925486339,"học chương trình lý mang hình thức tập toàn viên kinh nghiệm phát triển tư năng sinh động thực tiếp cách đề tài hợp biệt tham gia"
892649937474491,"kết sự đồng nghiệm tham gia"
533714410128929,"vietnam saigon"
180347198968408,""
1485905395049069,"sinh học biệt mọi nhân chúng quan trình tạo hàng tài cách tham gia thức thời gian bản tập thực năng cơ diễn h lượng tổ chức công điểm kiện viên hoặc đăng ký tiếp tư"
551504168321268,"tiếp thành công học viên thông tin chi tiết nội thứ hàng thời lượng buổi cách ký phí nguyễn minh quận tphcm hoặc đăng"
1017664094920484,""
959475154113973,"thời gian đăng diễn chủ nhật Địa ký chi phí chương trình"
2111249605680682,"việt nam thể diễn dự nội lòng thành phát giá chí minh khách lý buổi vietnam"
630508290397731,"chi minh vietnam"
553994564753217,""
989215157823834,""
1151740234853898,"saigon trình diễn kinh"
1652058751713806,""
1681847088719406,"chủ đề nhân gia nguyễn thời gian điểm h thứ hội trường kinh tế quan đồng chức sinh thể động thực hiện thế hệ nam giới tiếp phát triển đầu tư trình diễn văn lý tâm liên kết cách hợp sự năng cơ bản việt dụng tham viên học tphcm chuyên chương tạo"
549192808571431,"dự văn giao thông quận trung tâm công nghiệp hợp hàng khách hệ"
1647507122170549,"hội tphcm tiếp tổ chức công viên văn thông mang nam chi tiết"
189186581416344,"chúng hàng thứ thế gian hội hiện thể nghiệp chương trình sự mọi nhân toàn sinh viên học công chức động nội gia hãy tham đồng tâm phát phần tài tin nam dành thành lượng phí chí minh h năng quan điểm chi tiết liên đăng tổ thức diễn vui"
940016226073543,"pm"
1712903448943953,"kinh nghiệm kết tư nhân sự nghiệp hiện việt nam dụng năng công viên thức chuyên thành bản giao tạo học trình thời gian h Địa điểm gia quận tphcm tham dự lượng vui lòng phí đăng ký"
906401222748379,"chúng thể sự kiện quan diễn nhân sinh nhật tổ chức buổi chương trình nam giao kết vui phần thực hiện đầu công mang cách biệt học hãy tạo chi tiết thời gian pm Địa điểm tphcm giá hình thức hoặc tiếp thành viên hàng quận tin liên thông mọi hệ"
665950596841543,"saigon"
893238854063197,"sinh tạo kiện học viên toàn quốc cơ hội giá tổ chức tập chúng tham gia thời giải đồng phần phí hình thông tin dự trường thể điểm cách quan hoặc phát hiện tư gian chương trình công kết tiếp liên hệ thực thứ hợp dành"
638776259596185,"học tiếp thứ văn chi quận tphcm vui lòng đăng ký hoặc thành trường công sinh viên bản hội tổ chức sự tạo chương trình thực tập cơ quan tâm dành quốc tế lượng giá gia thế giới liên kết nhân kinh chuyên toàn tư hiện động nghiệm kiện mang thể buổi"
1043554092355578,"chủ đề quan tâm biệt động hiện kết thành toàn thể hội điểm cách phát thực tế giải thức thế hệ triển chương trình tạo chức năng lý thời pm học Địa quận thông tin chi tiết đăng vui lòng"
840096532780434,"vietnam"
945773412167164,"saigon"
537514949731000,"tài giải giá giới việt nam thành công mang nghiệm diễn vui lòng đăng ký phí"
951818681522660,"thế hệ việt nam tổ chức buổi phí chủ đề chuyên nghiệp học sinh quan tâm hãy chúng thời gian h thứ Địa điểm hội quận thành chí minh lượng vui lòng đăng ký thông tin sự tiếp"
1728205167392156,"tổ chức dành thời gian thành viên tham dự giao chuyên đề gia sinh kết động vui chúng học tập chương trình buổi phần hội hợp thể nghiệm phát triển hình sự thông biệt giới nội nhân tiếp phí đăng ký"
1229112313782698,""
906639566051815,"thành viên tham gia đăng ký thời gian thứ chủ nhật đầu Địa điểm tập hợp trường chương trình học phí tiếp chuyên tin động thông tạo diễn nghiệp"
425697107630544,"thứ thời gian Địa saigon văn quan hãy chúng dự sinh giá toàn thực hiện vui lòng giao cơ hội học mang mọi đồng kết kinh nghiệm pm"
1026266517404863,"trung tâm tin học tphcm chương trình tạo chuyên dành đầu nội phí đề toàn phần bản đăng ký h thông chi tiết vui lòng"
143078432716580,"hàng công giá dành khách quan triển biệt hình"
454615604712551,"minh giá chuyên gia nghiệp tư"
465988266906746,"tạo vui giải gian cơ hội giao kết hoặc thể hiện năng bản trường chí động thông tổ chức chương trình tin thành viên đăng ký phí tham gia thời h Địa điểm học minh quận quốc lý nguyễn phần đầu công văn mọi lòng liên hệ"
901441069942273,"saigon"
1489600091342084,"giá"
426995257494915,"chi minh pm"
777733555669023,"cơ hội tiếp chương trình học quốc tế công thành nghiệp phần bản viên cách thức chuyên gia sinh trường kinh nghiệm hãy đăng ký thời gian phí nguyễn minh quận tphcm hoặc"
1690758604502588,"sự giới chủ đề diễn thức học cơ bản đồng thông nội chúng động gia dành hợp chương trình tham phần hội đăng nhật tin"
1484609308508052,"cách hoặc hãy hình thức toàn thành thế tham quan viên thông đầu quốc gia thời gian vui nghiệm chúng thực hiện động hội việt giới năng trường tạo hệ bản thể"
917672741659862,""
511804775649731,"hình tổ chức dự gian hàng thực thời sự kiện tham quan lòng điểm tâm văn dành mang việt nam nhật bản giá thứ chủ đầu trường gia vui liên hệ tư"
549624805200267,"vietnam nam sinh nhật buổi thông tin thời gian pm Địa điểm nguyễn quận tphcm giá hình thức hoặc tiếp vui lòng đăng tài nhân viên giao nội thể liên thành đầu hãy hiện hàng dành mang phần biệt chương trình công tham gia toàn kết chúng mọi hệ chi tiết"
901636653224227,"minh triển trường nội quan tâm chương trình học quốc tế kết thế giới tham dự hàng đầu thể vui dụng hãy gia thành chí sinh khách ký chúng sự kiện thứ hình phát chi"
